reviewId,userName,userImage,content,score,thumbsUpCount,reviewCreatedVersion,at,replyContent,repliedAt
gp:AOqpTOHdm26zn4wiNR492y0UNtNOf6_AJ8deqM2aX8VqzYqzU7bwNBpOl410acCsZzRdvCmTZUZ2EycVkzY50g,ãƒžãƒªã‚ªãƒ•ã‚§ãƒ«ãƒŠãƒ³ãƒ‡ã‚¹ãƒ‘ã‚¯ãƒ‘ãƒãƒ³,https://play-lh.googleusercontent.com/a-/AOh14GjZbpGnSVpkMd-AWqiwPLBmydW6gbpHwAfny53G8A,Untuk Pembayaran Harap untuk Menambahkan Aplikasi DANA,4,0,3.19.3,2021-11-21 01:41:31,,
gp:AOqpTOHfNY0UJlss-dgfhKo6OvmoYU2h6Uaoh-4fDXDXLoHXDN3ckd5NT64pY8CxzELN2kGdLaz6d8yVsTkceA,Imam Wahyu715,https://play-lh.googleusercontent.com/a/AATXAJwS0CBZVY3cFSUMcLoYeAmphmf97jYrsqdeMfZd=mo,j9m8kps dibantu kakak,3,0,3.24.0,2021-12-31 04:24:40,,
gp:AOqpTOGVpifahrCChcp19rnKwuQgtRwzuFNMy4IyPxReqXkZL3XB8jGmzrYj_7bshL-vGraqHB-9Y-08k3hHfQ,RinTan #25,https://play-lh.googleusercontent.com/a-/AOh14GjguQfOzhD9GBxQDbO6pHm5Jppucj0ym_T4xw7VUQ,"Semoga membantu saya dalam hal keuangan , amin",5,0,3.22.2,2021-12-12 12:18:53,,
gp:AOqpTOHsd39Uy_XgjXCaOamqo2fmJnptdjm4w6QT8fEzPOpnZEN51L5YN_ZqTm-VbFLoqDjtrM4t1v2ZUarnYw,Kicau kampung,https://play-lh.googleusercontent.com/a-/AOh14GgS-mMn1qTlqQlIeDwyImeJukbi1lcuIprbCYXEjg,"Coba siapa tau peluang masa depan ,",4,0,3.22.3,2021-12-23 22:36:41,,
gp:AOqpTOHhKRiEYvpmdGrWfd8YuJX6UhpPM9Dvk99Gq_qPML885eAeiqcI_AYRmhEAXH7QQTlqIKUBr7q2slL94A,Junaedi Junaedi,https://play-lh.googleusercontent.com/a/AATXAJyTceF-k_XtIDmCUe7Rcf-rqZBd_vkMpTOakleN=mo,Saya mohon agar bisa di percepat investasi nyah ðŸ˜,4,0,3.18.1,2021-10-28 20:56:54,,
gp:AOqpTOEKNATlz-iT48zq_JkGP4ahMqJIg-glRVr7TD1CAcjJptLWh5-po2s24ZYbW54osGO8VlxotGnJ4-tm2g,Itsna Najatun Nafiah,https://play-lh.googleusercontent.com/a/AATXAJzVDQcOZVox9LBfXAr1h1UR7rPZGuNX0jCCMnIJ=mo,Yang mau dpt 25.000 pakai kode ini ya ðŸ˜Š = farahbintang,5,1,3.19.3,2021-11-15 12:22:11,,
gp:AOqpTOHLGGzeUPArimFxiYZ5_Af0wDsx9cS16JnE07-BMviuHBOpAomMPHRgJFWQWeEXHTMpydA3I9U2wqUixQ,Agoeng Gbastian,https://play-lh.googleusercontent.com/a/AATXAJxHpw3CMqxSGqzwb8tZLxWjYJxnU7el62R2bnb1=mo,Nabung yang aman ialah nabung sendiri di rumah pakai brangkas berkode. Jamin 99% keamannan nya,1,1,3.18.1,2021-10-26 09:20:04,"Hai kak Agung, tidak perlu khawatir karena Bibit sudah resmi terdaftar dan diawasi oleh OJK dgn nomor surat KEP-14/PM.21/2017. Jika kakak memiliki pertanyaan atau membutuhkan bantuan, kakak bisa langsung menghubungi tim support kami yg siap membantu selama 24 jam melalui live chat/WA +622150864230. Terima kasih",2021-10-26 14:29:12
gp:AOqpTOFK1jFDv1mHGNMyGEMOCy9xjpMUHSB3WfC44EQn0vnADn20ADosPVktJeC_UqeXlioebXGvILDvtkGpEQ,Fernanda Putra,https://play-lh.googleusercontent.com/a-/AOh14GhLw-5E7iiG9adXinFsNcvIvhxh7Dvbm61OyrP4,"Pelayananya baik, langsung di respon dong.",5,0,3.19.3,2021-12-02 08:08:40,,
gp:AOqpTOGxza2mo-oRMUFKbhlih5btCfdWErlvCCbXfHA7zhZXNTynnZf64dzLDycah6FNcPMq4SElXE-fN99J6w,Kojeq Ilham,https://play-lh.googleusercontent.com/a-/AOh14GgcRjK7IoSQgEM3UEvBaeU2xgVE_UHqm71Z-p28,Alangkah bagusnya lg kalau bisa top up pakai DANA,5,0,3.21.0,2021-11-25 17:56:56,,
gp:AOqpTOG9YYKBHj_yoy8ilp1beo4xGi_D4K8ksyOSIHQx2dpKQ-wXmH7HI2r6VkqRP2TKGOQf4h7NPUfm7I3y8g,Uang Muda,https://play-lh.googleusercontent.com/a-/AOh14GiH5u3j83mm-nwGw-1GCSy91mw9Tb72ldEq4Hee,Hahhahaha menyesal gue Kalo dari awal tau begini Mungkin sy tidak akan pakai bibit,1,0,3.19.3,2021-11-18 13:29:45,"Hai kak, jika memiliki pertanyaan atau mengalami kendala terkait Bibit silahkan langsung hubungi layanan live chat atau WA +622150864230, tim support kami pasti segera membantu masalah kakak. Terima kasih",2021-11-18 16:17:57
gp:AOqpTOGrvqdPCelEIe6mKNxQmc6j-pF9P20P4xWGnSkPs7kvn54nTv7lQYQWZewOqGuUYJOXoKJfPL30Hm8X1g,Gentow 0,https://play-lh.googleusercontent.com/a-/AOh14GiGphnE7HpGPu0zvkRRkg_Uwn9TvcZq4HdIfLMK,Katanya dapat bonus 25ribu ? Gak ada bonusya,1,0,3.18.1,2021-10-20 00:52:22,"Hai kak, cashback 25 ribu akan didapatkan jika kakak registrasi menggunakan kode referral teman kakak atau kakak mengajak teman registrasi di Bibit dengan kode referral kakak. Silahkan cek di menu Profile -> Kode Referral. Info lebih lanjut hubungi layanan live chat Bibit atau WA +622150864230 tim support kami akan segera bantu kakak. Terima kasih",2021-10-20 12:27:35
gp:AOqpTOHGwPLqADqg7MjGDNYeY-quRXB4p_c9N3CVyl0M6Xt_eRFWxivWPhey6zQculFo9bUgZQqSCViQ_dkOfQ,Nurul Habsi,https://play-lh.googleusercontent.com/a-/AOh14GhoFwNziW9tAf5UjoZXAfG4FwvJq910VcWCg2dS,"Yuk ikut kode ku agar dapat 100rb, kode : ksmbrlg",5,1,3.22.3,2021-12-14 18:51:50,,
gp:AOqpTOEnlnDZSimN5NpqJhUr4eLdIodh_xpjYR8-frxlv4aS5rl0JN7P0RSLNTDYgG-kWiEv_Z_3SDW2epQbVA,Nur Chatami,https://play-lh.googleusercontent.com/a-/AOh14GiLwZymy5a-VRp7hEi8bESKGSLSSTEwYbfMxvfoug,"mantap, apk ringan, uitm nya bagus, overall good",5,4,3.19.3,2021-11-12 07:03:20,,
gp:AOqpTOHylo7g0x5_iOS5nQVzG28r4CG3h_Rbm3johD2YEkfu5L6TsAlAQQm-xQw2NDh-Hi2TvbKa_vZEnRfocg,Ely Ameliya,https://play-lh.googleusercontent.com/a-/AOh14GiYkFTWSfkebsBgdBTB-oBOYPB71dY8pUun1gNd,Sebenernya sy ga ada duit untuk pake apk ini :>,4,0,3.19.3,2021-11-08 18:45:20,,
gp:AOqpTOFT3q_CqomBDzhvST1ZRx3J9AA2nDCLyr8pz8ew_rLbfS4xvw7n76N6VBtssjo8zqXFPGOZtIC435XH3g,Hariyadi,https://play-lh.googleusercontent.com/a-/AOh14GgatWLiRiDEzmq9TW-mCJLUPyHYincBxSZaULduRA,Lumayan bagus bila dapatkan poin...,5,0,3.22.3,2021-12-21 01:27:08,,
gp:AOqpTOGf5EMjfyNN7p6uw3fNKCtxvQtNhz0-EwRKE7YdqDSw-XxLByZDToufa9W7EHZ23I31rOo5f9_rYkeuUw,Bila- chan,https://play-lh.googleusercontent.com/a-/AOh14GjObjj7G6hL5T2komokaEj5VOkTGHN2EIxYL-wg,Isi kode referral (cogas). Ini bagus,5,0,3.21.0,2021-12-02 09:30:06,,
gp:AOqpTOFa6eYPCLCOC1u1nHhNjeKz8ajEVMGFCxVBBlbBMpF7Qco7Na11ym6EskVcVWr6QiECD9milGcoWMgMgQ,Dimas Aria wicaksana,https://play-lh.googleusercontent.com/a-/AOh14Gj7y37shUN0U3DSGg4bjLwv2h6kfuDrk6N2RQ5E1w,Suka Lama ni pas buka apknya,2,0,3.24.0,2022-01-02 08:49:08,"Hai kak, mohon maaf atas kendalanya karena saat ini sedang ada gangguan dari providernya ketika membuka app Bibit yang terjadi di beberapa user. Untuk kendala tersebut sedang dalam proses pengecekan team terkait. Kakak tidak perlu khawatir karena data kakak tersimpan aman KSEI dan dana investasi kakak aman tersimpan di Bank Kustodian :) Trims
",2022-01-03 10:04:52
gp:AOqpTOFpishVQFZ1nyemlz6poDjr119_2k5F5DKuX2gZn-QSypWmmNdZRsmMHQwr7H2xZQO_nN27wtdQncxB4g,Rohil Anshori,https://play-lh.googleusercontent.com/a-/AOh14GjsNVCNeERG8nwuRvnAu8_sIYshGrf9Ue0vFJye,UNTUK KAWAN KAWAN YG BLM PERNAH MAIN REKSADANA SARAN GUA GK USAH MAIN KARNA TERLALU PANJANG PROSESNYA BAGUSAN SIMPAN UANG SENDIRI,1,0,3.21.0,2021-12-05 19:32:16,"Hai kak, untuk pembelian dan penjualan reksa dana memang tidak realtime, karena membutuhkan proses verifikasi dari Manajer Investasi. Jadi prosesnya membutuhkan waktu sampai dengan maksimal 2 hari kerja. Jika ada pertanyaan lebih lanjut, silahkan hubungi live chat Bibit/WA +622150864230, tim support kami pasti akan langsung membantu. Terima kasih",2021-12-06 03:16:49
gp:AOqpTOFwE50k_Py462Nx7KHuy-q-gUKFiwUeVWcAV30oh7un8UIamGIkqMq4WcVlGTK0odpRbFoYi0G4AjuVcQ,dewo Masriady,https://play-lh.googleusercontent.com/a/AATXAJy1VGHVRtJOqg1IHgLzE7waZbFIFMepCQbuvM4r=mo,APLIKASI PALING TIDAK BERGUNA. NYESAL INVESTASI DISINI,1,0,3.21.0,2021-12-07 14:17:10,"Hai Kak Dewo, jika memiliki pertanyaan atau mengalami kendala terkait Bibit silahkan langsung hubungi layanan live chat atau WA +622150864230, tim support kami pasti segera membantu masalah kakak. Terima kasih",2021-12-07 15:38:30
gp:AOqpTOFr6XQmSOKMsV4q_2jeA2yTF_N6VfXD1fKaB43b8yc5EJf-bZTe-LJS0H2XVRgkGGiihvORsewgUFV7Rw,Riefky Candu,https://play-lh.googleusercontent.com/a-/AOh14GgwpjuvLa-WKO8VdWnQYxBij3CcyA4AXOdzbfDQ,good aplikasi untuk ber investasi dan menabung,5,1,3.19.3,2021-11-04 22:02:50,,
gp:AOqpTOEI3bWbDPBTvGRDlf9wPBcQSTo1PTQHXWtROY-smWjKZOHIStlPuTF7HEjkLEwoWxH7HYdRt770LJLRwg,Rudi Syahwan,https://play-lh.googleusercontent.com/a-/AOh14GjyCAw_nPLuTvNYheeJ-HA9aMFpTMxwuR-L51NA,Saya mau coba nabung tapi dapat tambahan...,5,0,3.18.1,2021-11-01 23:24:36,,
gp:AOqpTOHLZQ2qRInol7BIW2IrxJ6mTlyU7vO1c_jHfgZx8Vf9dJnNACTzHJqv2sY_WbEu4T3H2762IGFeUw--GA,Kholis Majid,https://play-lh.googleusercontent.com/a/AATXAJw14UcS9S3SomxkAvZbiLczuWZpTpLwmBPHH2eV=mo,nabung masa depan,5,0,3.23.0,2021-12-20 21:20:17,,
gp:AOqpTOGjqVj5CB7zcrVgv6EiL72JgiS08WRKPiZ51575aZfMxfBDoFE2Qd0FsS1fFTV_oWp0g964W1rQiudBDg,eSCe Okki,https://play-lh.googleusercontent.com/a-/AOh14GgYU660IPKoiSlfcE-0rjUafsJoGTdyPJkvyYQ_,"Masukkan kode referal ""satuklik"" dan dapatkan cashback 25rb",4,0,3.22.2,2021-12-12 19:36:02,,
gp:AOqpTOGlVmDfypnPwAWijm4y_v3U5PY-fbjgK8ldf2kSZHykrcNjmIy4aoN9fbZRbgIowh2YE1Maps36QRaxDw,Vava,https://play-lh.googleusercontent.com/a-/AOh14Gik76DY3DjfmQ7j3mv2lv7Ci-67I8JOQCDrMzhZqQ,Pakai kode referral : fixbisa untuk dapatkan cashback 25rb.. ðŸ’šðŸ’šðŸ’š,5,0,3.18.1,2021-11-02 06:40:32,,
gp:AOqpTOFzTCy719nFYIFguAESyn1E_mJDFtouo98RSHVr8fdSTnefPZywzjVFrfInDmMw0S8zEH7hH9vphMuEkg,A l i f,https://play-lh.googleusercontent.com/a-/AOh14GivLOBHbEDzgLlHFH6wqyOAjUwN-lsKQHWLGc7-EQ,Ini sangat keren untuk memulai sebuah investasi,5,0,3.19.3,2021-11-11 02:19:47,,
gp:AOqpTOFtbZlieE79ACsDCeSLqJX8gzY4ZhjrL1KkD22IjNY0iS4AwSF7C0mYnaot3OqfdLRFTTvfZAIFYjjQYQ,Rudi Daboang,https://play-lh.googleusercontent.com/a-/AOh14GjCJUmEaoDwoRHPijCm8IlRm2y9L83iMxfWN3hySw,baik sekali,5,0,3.24.0,2021-12-31 21:56:05,,
gp:AOqpTOEyefKG4IkOptggCBNV7_Z1QfX0MzALarnCmBm2t_gftIsLWwGziG88z5HZb9iKF8fBlWkBfbZNasKvKQ,Mohammad Fahrizal,https://play-lh.googleusercontent.com/a/AATXAJzIFv3sTgZRIsWJ6iCv5rOM9zHfxBL-1i1JN1h-=mo,Aplikasi terus terusan eror tidak bisa dibuka,5,0,3.21.0,2021-11-28 08:14:33,,
gp:AOqpTOG85LHWQkeQqqQaOyb6cfBLgwjS2IEOBCUhhaF5diu7cO6a_EyhBHE6ZpIcKaz_0tv4SR1AlrP7KgeaKw,Kris Ninja,https://play-lh.googleusercontent.com/a-/AOh14GjUkikapECnwCEFS5ODyoUoldlEVws9fcmi2KRetg,masih pemula jadi belum tau kedepannya gimana,5,0,3.21.0,2021-12-10 07:37:31,,
gp:AOqpTOFTuCcqm5_53yTHkdMNjX0v6a8o-ihayVoOLrXQut2n-M9lvvpIJIj_T5RGGnlEOsDQgR1JdmHI_i2u4Q,Ade Munajat,https://play-lh.googleusercontent.com/a-/AOh14Ghc8DtBSIcOPCOjPv3R3JbtjpnG5L_7GxbQ4t_cgw,Bismillahirrahmanirrahim!.semoga tersemogakan,5,0,3.22.2,2021-12-12 17:24:18,"Hai kak, dana penjualan mengikuti NAV yg kakak dapat dan dikirim Bank Kustodian ke rekening terdaftar di Bibit sesuai ketentuan OJK maks 3 hari kerja utk RD Pasar Uang dan maks 7 hari kerja utk RD Saham & Obligasi. Jika lebih dari itu dana belum masuk, hubungi live chat Bibit/WA +622150864230 agar tim support kami bisa bantu lebih lanjut. Trims",2021-10-28 08:16:17
gp:AOqpTOHgwhldR0MOi7USMsRGHJZsP7aTlgOmlD_Y_Bvg_WvUtKrg_KCxkBT2PBUGRs4rnW0q-6xABI_8ahs-3Q,Godlif Godlif,https://play-lh.googleusercontent.com/a-/AOh14GgRmTmnciEIA7wtjC9rsnrXyCTeXH-zH8AmscG3,5 bintang langsung walaupun saya baru install,5,0,3.18.1,2021-10-24 16:48:33,,
gp:AOqpTOGqkfP-Szu-9zgtIcCA_EbC3689SmTey6Ti3zh6l6F2WQ3LW-IUBhLYzN5LaUSDb4jKxUbsiYMZ5pqfPQ,Wahyu Adam,https://play-lh.googleusercontent.com/a/AATXAJw5V7swHcM_0BpR7NohksDgCq8kHSu1_alEVQuL=mo,Pencairan lama dri hari Jumat . Blom msuk rekening tpi di statusnya udh terjual,3,0,3.18.1,2021-11-08 14:31:09,,
gp:AOqpTOHgCUvgUrkJe1Wjbzd8BJOgBdc2PezKJE4B5traEIMO1SAEMzU60nU4KDhJRLW7f9FTOAWu3mqzC3nZ3Q,Ahmad Khotib Al Banyuwangi,https://play-lh.googleusercontent.com/a-/AOh14GiJFJ_G74TimAaB0BZLEY5ewcFu53Yw9cTrARzrkQ,Bibit bagus tp pencairan milik sy kog lama ya?,5,0,3.19.3,2021-11-14 20:17:26,,
gp:AOqpTOHAAZQPekI9kTJ_giiXX135csW4pEGB3lPdhF7aYodOmB7yAeQncW2fZ3j_EG4Jml5U_8UCp5mx2StFEg,Ari Wijayanti,https://play-lh.googleusercontent.com/a/AATXAJxywYz3Gfqb0nCGPBpq8uFjkUBUMSjzVswElW9z=mo,sejauh ini bibit Oky mudah di gunakan,5,0,3.22.3,2021-12-17 00:12:19,,
gp:AOqpTOH7vzIBdBuV-NoXWYa58IUYtWDl2qrdyDeW85JrRw5s2CgiXtdE1IOTzeqIlFYgeSZinrkmgV8FhFCXpg,fahat mutaqin,https://play-lh.googleusercontent.com/a-/AOh14GhQf63PX54unauAJjkyk5-aZtlwAM5pzfvhSjQA,Masih belum bisa cara kerjanya apl kakðŸ˜ž,4,0,3.22.3,2021-12-16 17:18:46,,
gp:AOqpTOFsh7tzmvdK0sVrN8BZzwrMsV0A2FF0GaoCoMZbfL1b_OUim5XG756bsbMIpFabt05TOCp_fWyTqYNGRA,Muhammad Riziq,https://play-lh.googleusercontent.com/a/AATXAJz48pjKg07u9zIFGw5hNhg33Twg1P4kDErQm7lh=mo,Kode reff : betisnyamuk (cashback 25rbðŸ¤©),5,0,3.18.1,2021-11-17 08:28:57,,
gp:AOqpTOFjUu1muLO18aeQ2ckFV3USNMZUA05QZ6SGYzPep_NtphxfOdp1sKRD1PL_kjHPWuExLTF4ujpyrg3Yug,Namaku Semesta,https://play-lh.googleusercontent.com/a-/AOh14Gj9ubwHYMPSRuhvEjdbvZ9KSD4LyQCEMiAy_AKXmQ,Mantap deh. Asik nih bs nmbh cuan lg sm kode ini - knsolyn -,5,0,3.19.3,2021-11-08 13:46:26,,
gp:AOqpTOGP_fEHNhZEWxCwTP3NJByvzXd1v8pDurHTwX6x5O7KCXC0qcAAMK2HuM2_wXUABRmn_qAGob7Wrvnhuw,N & A,https://play-lh.googleusercontent.com/a-/AOh14GguSAtsWNuW9nczFBL5xqcMcmdfeUGkD_CauW83mw,Gk bisa masuk ke dalem aplikasi nya,2,0,3.22.2,2022-01-01 17:50:51,"Hai kak, kemungkinan jaringan internet kakak tidak stabil. Silahkan gunakan jaringan lain lalu coba force close & clear cache terlebih dahulu ya. Jika masih terkendala harap langsung menghubungi live chat Bibit atau WA +622150864230 agar tim support Bibit dapat segera bantu lebih lanjut masalah kakak. Terima kasih
",2022-01-01 19:39:58
gp:AOqpTOFJFs78lHHPEfen5k9VTS-RJ5BJY6GrZbBRz2LCvQAaWvb4GlzWHWCmhRiu3aMlhqp12-NJcrQ_oVGFQw,arvandika Channel,https://play-lh.googleusercontent.com/a/AATXAJzrrZX2znu_67oYIRkw9Jz-FVds4LDOPolzFH7T=mo,Lebih baik peluang yang nyata sesuai nominal,1,0,3.19.3,2021-12-01 20:12:02,"Hai kak, investasi ibarat seperti sedang memulai Bisnis, tidak ada kepastian untung atau rugi. Dalam jangka pendek market bisa saja sedang turun, namun kakak tidak perlu khawatir, karena dana investasi dikelola oleh Manajer Investasi profesional. Info lebih lanjut hubungi layanan live chat Bibit atau WA +622150864230. Trims",2021-12-01 20:27:25
gp:AOqpTOH5wcb7dbrrsuvlr00U6oFMDcI6TWVCAgRNUA4ji2nQFTVodO2y9_1sfnkRRnTjPrukymHHmQfq-tLApg,Putu Kusmadi,https://play-lh.googleusercontent.com/a-/AOh14GiPRm8HDvev2dq0XdBydnj2gaHN9SDdxGOinKEvuw,"Semoga berkah pake Bibit, masukkan kode referral; pyanho",4,0,3.19.3,2021-11-12 19:58:01,,
gp:AOqpTOEDh7M-uNl-Qzm1tfWLhN-ABxcGk8H127pFphX0AYiPJkb65PpqKPJCncYjBJz-KQO17AXhWq9O6JuiFQ,Ardiantara Yudha,https://play-lh.googleusercontent.com/a-/AOh14Ghewqr56y0Xz6DOmKJvApKL6jnQ__8RPQuLF1jCKA,"Kalau ingin cuan,Ayoo Gabung Ke Bibit Bersama Saya ini Code referral ðŸ‘‡ gabungyok36",5,0,3.19.3,2021-11-20 15:03:30,,
gp:AOqpTOFuL0n2juyaoet1etTuMHrpeS39mQuKkwM_T9EK4riXMGaTSxyJxGuc14KnxuGvy8TM8FboVOiaMUl0AA,Ani Kustini,https://play-lh.googleusercontent.com/a/AATXAJw1FU_7Bcfu1ZPHiQcjb3UMjqe6CzgylPJaH3Xh=mo,Mudah dan Aman,5,0,3.24.0,2022-01-03 10:11:11,,
gp:AOqpTOGZOMbnVpahNTxUKK05CjZmE_5SrO4Qt0N1IY_QVsVTFCAj7aUHrbPftxtI-BrBST4Xgr7_QNQ8Xj963g,Bian Mly,https://play-lh.googleusercontent.com/a/AATXAJzAnZsqVBu-VZkdKIZQ37hnsvN9O5wI9J5sDmQt=mo,Untuk Wd membutuhkan waktu berhari hari .,1,0,3.19.3,2021-11-20 18:48:23,"Hai kak, dana penjualan dikirim langsung dari Bank Kustodian ke rekening terdaftar di Bibit sesuai ketentuan OJK maks 3 hari kerja utk RD Pasar Uang dan maks 7 hari kerja utk RD Saham & Obligasi. Jika lebih dari itu dana belum masuk, hubungi live chat Bibit/WA +622150864230 agar tim support kami bisa bantu lebih lanjut. Terimakasih",2021-11-21 04:59:44
gp:AOqpTOEEMd1t3kgND7QiD8l7dMIvjnfHFhpT5ySdzp_oYIkZ7379OSkYlJdbDssKNacE03MC_7gjcKs8l4K7CA,Ahmad yu,https://play-lh.googleusercontent.com/a-/AOh14Gi1LVWXDu9eKSiHdPexqVAh7UdaOjvqiYugxTR0ag,Penerusan dananya Terlalu lama Ya mungkin bisa diper cepat lagi gitu,2,0,3.18.1,2021-10-30 16:15:00,"Hai kak, dana penjualan dikirim Bank Kustodian ke rekening terdaftar di Bibit sesuai ketentuan OJK maks 3 hari kerja utk RD Pasar Uang dan maks 7 hari kerja utk RD Saham & Obligasi. Pastikan rekening aktif dan cek mutasi rekening di waktu tsb. Info lebih lanjut hubungi live chat Bibit/WA +622150864230, tim support kami pasti akan membantu. Trims",2021-11-01 08:23:22
gp:AOqpTOFVbw67qe-JUTmt1RUwX6K1bllnDbCnnYCVzbp_EX6mdc2W32SxGgV2bklNFONuSFI7VCydq3kqWe8_mA,Game Moba,https://play-lh.googleusercontent.com/a/AATXAJyCB3hPMyculBvAYESCOKlBNU4jxPDtE6MOtiY_=mo,good lah... semoga ada tambahan fitur2 bermanfaat lainya,5,1,3.19.3,2021-11-14 20:47:17,,
gp:AOqpTOF0dOdt_dpfur0hmdmfmMA_RJSq1ZjuvtNApcIR-Ts6mwcq3gfb3qRmgkl0ud3vL_XvQlG3Asi3uFg6sA,Ibnu Hanafi,https://play-lh.googleusercontent.com/a/AATXAJzU8ZNJaMET6zcAQYHK3GHJwv6MTm0Aa9_KiIOe=mo,Yg mau kode referal isi aja 4serangkai lumayan buat kalian cashback 25rb,5,0,3.22.2,2021-12-12 09:57:05,,
gp:AOqpTOELeX9ETGtuIba3Qs4VwrXxZQW_WCjGhxG3-jBksRLRdWrnoPXA_CMKfYJk6yfL5zdcEHdEyUxFcuivYg,Prawira Harjadijaya,https://play-lh.googleusercontent.com/a/AATXAJyr9tfwWgcL3YA8QRjoiMj-J7ON_Uvs6hqcBgjY=mo,Semenjak update jadi lama masuk aplikasi,4,0,3.22.3,2021-12-22 17:04:26,,
gp:AOqpTOE_LAfCluVsg4EY4Lp3JWP_ekIUTNxSvQj6cT_v6LdJyxK8l3_YjPAThGW6eNNFNzUJyTETgd6_z53UFA,Aji Maulana,https://play-lh.googleusercontent.com/a-/AOh14GgYCeIdnXWdnZHuBzvulSdqRSoajsb4-EGMgCb5ww,Pake kode ini untuk dapet cashback 25000 kode akhirtahun,5,0,3.22.3,2021-12-22 20:54:25,,
gp:AOqpTOGaNAXPArZkwkHrQOT2aR4R1y4ldfGV68nXi4PIWmLaKySx4JOVvo4eDjxj5i_MAUVQFVqCBscfej6bpQ,Syukrani Rani,https://play-lh.googleusercontent.com/a/AATXAJxGc32-5UNY_wLikI3Tz_2DQ07ndrXqhQxa5IU0=mo,Semoga kedepannya makiin jaya,5,0,3.23.1,2021-12-22 01:07:42,,
gp:AOqpTOHoB_iWl2sC734nUmQFaP2ng0ypn-P9FnmmQ4qj_mCiM3yk9_6I98Ftlg0Wp4Mns2sji3uJPTVXJz8XBA,Willyamsyah Saputra,https://play-lh.googleusercontent.com/a-/AOh14Gi3vU8Xe30JlOa2ElaMPr1gKdAWO9ktClbxu6NYBQ,Coba terus sampe ketemu hasil akhir,4,0,3.22.3,2022-01-02 13:56:58,,
gp:AOqpTOHY99MawW6uTxGGjJe304CO32UEAI1Sin5NBZbT2OKomWH-K1MyM3_BS4Su9F-pNsRZPQMFpFBkRiiaSQ,andre sugiarto,https://play-lh.googleusercontent.com/a-/AOh14Gjv1x3oz9vnK4t9yv8w1hJuwMX-GQXYtDBdTudX_g,"Yuk langsung dapat 25K dengan kode "" lampungituindah """,5,0,3.22.2,2021-12-11 14:28:44,,
gp:AOqpTOFv73Rg8Odxg7sz_2itWvPczy7jIXVo1az6eLLUzH1A2GtftP39N_XzfKHd68AcwR_X-AwkNo0HhwMi9A,Arya Teges K.,https://play-lh.googleusercontent.com/a-/AOh14GjdvqBg5VcqostbGEFRPVvm7yb8SzgT27Pj2xY_8bo,Tolong reksadana dari Syailendra ikut dihadirkan di aplikasi Bibit,5,1,3.21.0,2021-12-02 20:31:48,,
gp:AOqpTOET75VBALR6aid9u0Eq8XXIMUwdKeXavss-nkKDvT6pB1ZIOMdCHh-kyxGyro3IKz3e2O_RME0Tw_kWIw,M Johni Lung,https://play-lh.googleusercontent.com/a/AATXAJy5yAo-_-g6SgTeC3g3GL2jT7SEoaHadhzRBZnS=mo,"1 minggu lumayan 527 Rupiah, sukses terus",5,0,3.21.0,2021-12-10 16:31:34,,
gp:AOqpTOGwTJsE3tlPytetCQUV_3M0bIV3t0TPiutmrr8Jn5ullzBswiyQnvdV5ev4VJG9dbj3Ed9Zo2MEafwgnQ,Dhony Rahma,https://play-lh.googleusercontent.com/a-/AOh14Gg431UuwEgv-mXE4sH_6WsARpT4_01Dbd0Fkq2z9Q,Semoga membantu untuk penghasilan tambahan.,5,0,3.19.3,2021-11-15 12:35:19,,
gp:AOqpTOEQ_FzjOsSLOs6qgyBuMRZHFgyXaEyfE7VjGwBfT4YAJTgMNydRCq-YlpQQj90wv9_LLJlc632-LiSYVw,armala ibnu,https://play-lh.googleusercontent.com/a-/AOh14GhNOZblJddq2Ke7XMXla-oF1BJO14K99DIOLwuoXQ,Bantu wujudkan impian setiap orang,4,0,3.22.3,2021-12-26 22:30:21,,
gp:AOqpTOEpiaGVnj27ki9WXeaDLVM81i357RCADmPdaP2iyD892GXGKX2kRz_XUOTMzuoZ9u-IHEjHCyz65eBbGw,Al Gien Nor,https://play-lh.googleusercontent.com/a-/AOh14Gi-80o2rdEepCB_HA-CPLJ1jqfgL-WZBpHi_04i,"Dapatkan cashback masukkan aja kode referal ""pastidapatcuan""",4,0,3.18.1,2021-10-27 10:01:06,,
gp:AOqpTOFNkdPLx_eBHZComFtxw74qu0mETaz_yxctW7LNs5ORKbZUlKXMIXVx08RqkfhvXTHDEo_eJSSHkRBnDQ,Apep Munajat,https://play-lh.googleusercontent.com/a-/AOh14Gj6RM_GB-joT9gXzGMAZRccuBiUgrJJjLx6jpF7OQ,Dicoba dulu Investasi kalau menguntungkan tambah bintang lagi,4,0,3.20.0,2021-11-24 12:42:16,,
gp:AOqpTOFzi6zHF3XfvgqtrLhHAxL8qDjHhImyH5bqdI8B-HjzL2jA0zL08Ww0xdCdtexdegFC2kHn43YbNajfeQ,Willy BNS,https://play-lh.googleusercontent.com/a-/AOh14Gi7AiLMfUcxGCVx_G44nRr2vGRD7NLoLCAUPVY,"Asyik. nabung di bibit, selalu profit.",5,0,3.21.0,2021-12-02 21:22:40,,
gp:AOqpTOG8ohddQ-DNcv7KtY0Pm72sfJQIj3kQmTLPfPJ41Ry_dGs9TYYJudi8t3tcTOxZSoDEYDB9dhEk6P_YmA,Rika NURJANAH,https://play-lh.googleusercontent.com/a/AATXAJyjAg5Cv4SRnfUcylvoxLVBT1tDZJwnj1C6cx7C=mo,semoga cuan,3,0,3.24.0,2022-01-07 20:07:59,,
gp:AOqpTOECRnbNa2u6Ce6fZXApbIdDHtK0H0vzeZo4fYcrBi_XipAlthxjmhiTFraL00r6SwQVQQ5lJUk_e0wKvA,Hari Sugiana,https://play-lh.googleusercontent.com/a/AATXAJzka_XYJJ0htKrT3LM_DlNs9T7xKICBrFBxLT_d=mo,coba az dlu,4,0,3.24.0,2022-01-04 07:06:32,,
gp:AOqpTOFauqmFgMM5xPCk3i_5VcMXboAG8HV8LwpVmErV58CqUP40M4VuCrOQXjP-hq4BlBYa-Jak519b-YTLVg,Bocah Kaleng,https://play-lh.googleusercontent.com/a/AATXAJyqddDA4DqxKQOGYnhSNA5-q2bQ6fKwYn4KBcAL=mo,"Masukan kode referal bocell biar sama"" dpat cashback 25rb. .. gaskeun",5,0,3.19.3,2021-11-18 17:56:44,,
gp:AOqpTOHy7IZIpEK-BNnaWeKy3jAl7dqkfaSYqLaf5SJ_WNlJXIcqcdHvNKCMEWWeppKTe1FQ2XRnoJiGsC4amw,krishna purbo agung krishna,https://play-lh.googleusercontent.com/a-/AOh14GiH1aA8zIaMQaQFNby4Y0xsfywyEbag2dBoKtIP,"masih belajar, bintang 5 aja dlu, semoga emg bagus",5,0,3.19.3,2021-11-20 10:24:36,,
gp:AOqpTOFo0Z3JRGSNcakLvgEfw2weXrfWpxbgw9EJFpdG5mM4yxu4V7IX-mTthYkMQTJslnBDt-cOiGZiwV-hQQ,Salman Channel,https://play-lh.googleusercontent.com/a-/AOh14GjowVBJ5Y8-lYI_crSoW_wDgN07sddAzWbGP51Ajw,"Mulai beralih ke BIBIT, semoga lancar.Amin",5,0,3.18.1,2021-10-27 17:50:08,,
gp:AOqpTOFnAej06xO6ukL_E5_XhBqJwYRPkam4kkdFhWawNK6hdkCViLv6gsYR3B0jRGunBKBMkqJ7f5rUM1IVHQ,Krisna Cakra Diningrat,https://play-lh.googleusercontent.com/a-/AOh14Ghc1nNwpVhrbLNK3-qVZid359JbzC0mT8DBUoN1lA,"Masukan kode refferal "" sadarharipensiun """,4,0,3.19.3,2021-11-20 12:37:52,,
gp:AOqpTOGZsCJbWJYovLPfvNLTdHdsWPcBrHq2uZp3h2LGkhUrGtzxedrP36w352NFIfLtwjgBO59U6bDVyDVVUQ,Ismail Marzuki,https://play-lh.googleusercontent.com/a/AATXAJwh-g58lAoqwwXLk2gFhpb4rNHk6_aGcZbKAijq=mo,"Buat inves pemula mantap ni apk, dan buat dapetim casback masukin kode reff ""owiboze""",5,0,3.21.0,2021-11-27 20:44:52,,
gp:AOqpTOGLaBGY1zjFTlJpM_F0D3kJb3yvNike9ITiv-ukEGtone93HDgxTd8ItRuizAK2Ggp4i0cHucV9xK7dxg,Rizi Alfa,https://play-lh.googleusercontent.com/a/AATXAJzAYhDVOV0DTqbDM-nI5LERJUgQDBjSGroSYF1z=mo,Top up 100k saya tarik lagi yang masuk cuma 10 rbu?,1,1,3.22.2,2021-12-12 20:08:53,"Hai kak, dana penjualan dikirim Bank Kustodian ke rekening terdaftar di Bibit sesuai ketentuan OJK maks 3 hari kerja utk RD Pasar Uang dan maks 7 hari kerja utk RD Saham & Obligasi. Pastikan rekening aktif dan cek mutasi rekening di waktu tsb. Info lebih lanjut hubungi live chat Bibit/WA +622150864230, tim support kami pasti akan membantu. Trims",2021-12-13 05:02:50
gp:AOqpTOFfSlA6b0ODK25mOedregmJqs3ObH8RTIsPJjO934-IbrocuD4rRc3QD3-bQE0T70RmJ2Mnf7nRrQW1Ew,Lombok Tutorial,https://play-lh.googleusercontent.com/a-/AOh14Gj2i_yNF8FOkE3hHaTVNxZDhJxDwFu62aF1uVO3,Mau cashback 90k Gunakan code ini untuk mendapatkan cashback 90k,5,1,3.19.3,2021-11-18 00:34:01,,
gp:AOqpTOGwLd6dLSKjQR3Gqftp6N3-7BCsqBazt2qixyejjoM3EEzkhREUNKdCLFWh_Kpx-K74kt8H3iieVTC8_w,adrianto Nugroho,https://play-lh.googleusercontent.com/a-/AOh14GiemScxKKSNXueRZ4_1piEiqN859wtUaulYaeQbcA,belajar investasi reksa dana bersama bibit,5,0,3.21.0,2021-12-08 18:44:32,,
gp:AOqpTOGPdcfe1irCExU6n-1COa4gbqF0P4xbvYIhQ2MQQrFBaNamQBDYYp6UVio4tZ3Xo2HPMBpbjJ9vMbguZw,Helmi Susanto,https://play-lh.googleusercontent.com/a/AATXAJxcMzkO3gyYrQ9qj7o0A4fi35L6cON9-8ANN2b-=mo,Smoga bisa cpt buat nikah invest dbibit ini.,5,0,3.18.1,2021-12-12 09:47:49,,
gp:AOqpTOFYnMgPOrbFmlWUKEzYtAhs0MvtdpPqtiS0C3eWySV1FqHdTE0MU4A99HX8ouXQqRyEmFXQujY90u7Pgg,Aldi Nugroho,https://play-lh.googleusercontent.com/a-/AOh14GgVYgUbtISutMV-WLaNYNPr4aWEjoAT7batj_mp-Q,Kode referral otomatis cashback 25.000 (usahawanmuda),5,1,3.18.1,2021-10-23 17:49:13,,
gp:AOqpTOGAvoHksR7ljBWAW6J0Wr34xs3m7l3XcVRyq2ISg3f8f2BYwXWr4RJhKwIyZ9WvK5gqlCi52AJ5b_gzJA,SETYO PRAMONO,https://play-lh.googleusercontent.com/a-/AOh14GiHs1PBu_gP8iHSB7iPotRJWN_7JptDQOgG-IPk,Pertahankan kualitas dan pelayanan nya ya,5,1,3.22.3,2021-12-15 06:28:43,,
gp:AOqpTOHNgMJVh67-lCUiMbUIBy0Nltbksy7b5X6fMmMswd-Rwd9PopzgQY3pXFoA-zlIBVNo2otIkFWL060FiA,Defri Abiyu,https://play-lh.googleusercontent.com/a/AATXAJwSdmnupjXqGmnGI8mysB9HK0vxT7hGHelEJ5UK=mo,"Jgn investasi disini,gajelass proses lama bgt gila",1,1,3.22.2,2021-12-11 11:14:31,"Hai kak Defri, pembelian dan penjualan reksa dana memang tidak realtime, karena membutuhkan proses verifikasi dari Manajer Investasi. Jadi prosesnya membutuhkan waktu sampai dengan maksimal 2 hari kerja. Info lebih lanjut hubungi layanan live chat Bibit atau WA +622150864230, tim support kami pasti akan langsung membantu kakak. Terima kasih",2021-12-11 12:54:55
gp:AOqpTOFzaeCkgW_7TUv8r31NnOfQgoUck0Y9PoEdnUUo5VSpSxSMS7mCk-G7YjGIRqA7ONSM3hTRLXTguJ1HNA,Narida Berliana,https://play-lh.googleusercontent.com/a-/AOh14Gh6zAiOo848pUDfin9REgGwrAQXRl8_Q3gLWtY0,"ayo gabung sekaranggg jangan lupa pake kode ""kelkbus""",5,0,3.22.2,2021-12-11 08:03:39,,
gp:AOqpTOHbJAmIIVp77B1mxVIvzB2XKGyPAxPdtEFvUjJ-BcWtxpRsH6Nmr2tX5l2eVYY8QWPXjxSi_ZEvc9hZww,Andrizal Bahri,https://play-lh.googleusercontent.com/a-/AOh14GgAOAbVoey-0ziKoYYfkh9kbkjeGaPhMcL1Zvtq,Aplikasi yg sangat bangus untuk Investasi,5,0,3.22.1,2021-12-08 18:38:05,,
gp:AOqpTOFp6ZU33YdqOFSJDiD9uWH0xqjXTrCZ2U6Xz8sG0DoN5JX54_8D6aMmyQC24SQtga6h8r54Yp2qHCIX6w,anak polos,https://play-lh.googleusercontent.com/a/AATXAJwt9Zrm0vF_otoG0Oh3YSqSCXd9Q3cA6t1cEZ2-=mo,Gk bisa dibuka apknya,1,0,3.24.0,2022-01-02 17:51:25,"Hai kak, mohon maaf atas kendala sebelumnya. Kakak bisa coba kembali akses aplikasi Bibitnya saat ini. Jika masih kendala, harap langsung hubungi layanan live chat aplikasi Bibit atau bisa juga melalui DM Instagram @bibit.id maupun messenger FB untuk dibantu pengecekannya ya, tim support kami pasti segera membantu masalah kakak. Terima kasih",2022-01-03 11:55:31
gp:AOqpTOE7jSs1fAfUKNZ6vUhuP47tI0j59FfwWG5jUFJ0ZV6ax7fDVSc845Wrrrqs_qVeQw9L2QjNfUCn8_egPA,Sani Mutiara,https://play-lh.googleusercontent.com/a/AATXAJzpMziF1kA_MRQzQbJYSdf_Ch8wAECyrZzMPiaw=mo,Nanem bibit tggu 3bulan kaya punya sawah sehektar.........qkwkkwkwkkw,5,0,3.25.0,2022-01-12 09:33:55,,
gp:AOqpTOEuim9J4NSZSHAijT_uNbCguZohkuQO2dRRIctf0C8rB_9Ilxty5tsOOukcP3EKl9aj4jxrGUVc61qqUg,Nicitha Kayla,https://play-lh.googleusercontent.com/a/AATXAJxfcdPKsfjfxz8zcOKHZErEPzkxNtPccfGID39D=mo,cocok untuk yang ingin belajar berinvestasi,5,0,3.18.1,2021-10-30 10:42:37,,
