reviewId,userName,userImage,content,score,thumbsUpCount,reviewCreatedVersion,at,replyContent,repliedAt
gp:AOqpTOHeR78qJZnjiiUxE2cRl2xNJzeTtWjBmRJ7nOlYw_D_Yf4DoLLY9hOHHGpKq9WVzXb4Grl8IJ1U8ina4Q,Akhmad Navis04,https://play-lh.googleusercontent.com/a-/AOh14Gg-GvhltCC9Gt5wf176w81Upk1VENJVHz7sZs_t,Bibit sangat membantu dalam perencanaan keuangan Kode referral :Temanpertama,5,0,3.18.1,2022-01-03 14:18:47,,
gp:AOqpTOF0GTHUeLa2BMr2mucJ1g2qI1hHmntg0iLjCmhMIABgtP7Y2coo1T4M4AzHbOUVjelRwHZsVRHucZ5rPw,Cecep Anton,https://play-lh.googleusercontent.com/a-/AOh14GiyAc0N7liNPzYjfLz3CdWjN_Xc9n8awhEcc1mHpA,"Pembelian dan penjualan terlalu lama, buat yg butuh uang cepet si saya ga nganjurin pake apk ini",2,2,3.21.0,2021-12-02 23:58:48,"Hai kak, pembelian dan penjualan reksa dana memang tidak realtime, karena membutuhkan proses verifikasi dari Manajer Investasi. Transaksi hanya diproses pada hari bursa yg berlaku di luar Sabtu, Minggu dan Libur Nasional. Info lebih lanjut bisa hubungi layanan live chat Bibit atau WA +622150864230, tim support kami akan membantu kakak. Terimakasih",2021-12-03 09:04:57
gp:AOqpTOFgda9hto-1EKuKRxqAMZVK3oSd7ehXstQsSy4mURY7o434pdEQQrZg1RE9dFH_-gorffXFrx8Y5xZbhA,SyaikhsidiZunnar,https://play-lh.googleusercontent.com/a-/AOh14GgrYRx0il1p8BHd0ydQQ6QbY14Duif7r2H7Q229,Terimakasih ... Bibit terbaik,4,0,3.23.0,2021-12-21 09:11:00,,
gp:AOqpTOGMpqOa7Ua-oz5phl2eXe1plGkwEHrK884-BIo2Y2b_Bd5psc8C7a1OUzbpMrcAWbvrgWNX6cTtRuh27Q,Reka Miswanto,https://play-lh.googleusercontent.com/a-/AOh14Gj6FmrfxNIVA1g63Pdk09m9JpSB1zJl9IZZ8WTV,"Aplikasi yang mantap, silahkan masukkan kode -KARIMUN- untuk dapat bonus cashback 25k langsung saat registrasi",5,0,3.22.3,2021-12-22 22:16:21,,
gp:AOqpTOED4qqDa2KUJdRMgDB-_cFvkQCha694HBYw4TbNl2OtypzgcC7AzfCWVf2onDZSep-CdnTbV8XlE3UNWQ,Maudi Susanti_3A,https://play-lh.googleusercontent.com/a-/AOh14GijGxu4cxKDvn-Xb0CoiNXC92eQ936Yn2KvKvRI,Ayoo download bibit Dapatkan cashback Rp. 25.000 Dengan memasukan kode referral ( KEMBANG) Mari investasi untuk wujudkan mimpi mimpi kalian dimasa mendatang.,5,2,3.19.3,2021-11-10 15:17:28,,
gp:AOqpTOGkQYwswsQUZhV4O6_GjJaMWrzfeABxfYxz_d3WJipoTK_3IkfnrY5NWsr9KpSX7EptRx2Ch7xv36iLcA,HyoGree7 TM,https://play-lh.googleusercontent.com/a-/AOh14GhOBT77Bn0jgrPE21uT2fs3TOcZ1iFPTfAGKtS6,"Rugilah berinvestasi di bibit Setiap penjualan reksadana selalu minus...blum lgi uang admin banknya...RUGI,RUGI,RUGI,RUGI...mending kasi ke fakir miskin aja...",1,1,3.18.1,2021-11-02 16:39:30,"Hai kak, tetap fokus investasi secara rutin utk memperoleh harga rata-rata reksadana terbaik di berbagai kondisi pasar (naik/turun). Utk penjualan, jika rekening kakak berbeda dgn Bank penampung, maka dikenakan biaya transfer oleh pihak bank sekitar Rp2.500-6.500 per produk. Info lebih lanjut hubungi layanan live chat Bibit/WA +622150864230. Trims
",2021-11-02 17:30:56
gp:AOqpTOF9clcMzxsEDoJFWR9Ghup72F4K23oQGzmnITyfbM-77Qy16bwPe__P770dReUzDwx-YW9UAorFHpoMVw,Rangga Budiarta Priadi,https://play-lh.googleusercontent.com/a-/AOh14GiD176QZA0UJXfkgwchAYz6HYcew5Gjv07unacDqQ,"Simpel, Mudah dan Banyak Cashbacknya heheh yang mau cashback 25rb pakai kode referal = ranggabp",5,0,3.22.1,2021-12-18 11:42:16,,
gp:AOqpTOHG_2dgOTwsbS4uN8qZAkrsuFbZ_WlCyFD7fEWuhflYSsXoj0JF9Ip6WEOP71G5wobfC9D_PxeQ9vzAZg,Exodion,https://play-lh.googleusercontent.com/a/AATXAJxU_HNtd-c2TZgA7Mg83l1Hy5Koy00nTDvyUnEf=mo,"mending cari yg lain sih, kalo ini penarikannya masih di kenai biaya 10rb lgi biayanya, parah rugi",1,1,3.22.2,2021-12-15 06:30:41,"Hai kak, terkait dana penjualan kakak akan mendapat potongan biaya admin bank jika rekening yang kakak gunakan berbeda dengan rekening Bank Penampung reksa dana terkait. Biaya ini adalah kebijakan bank terkait, bukan dari Bibit. Info lebih lanjut hubungi live chat/WA +622150864230, tim support kami akan segera membantu kakak. Terima kasih
",2021-12-15 11:44:45
gp:AOqpTOH0GhF_JBTMYeKjnaf-jQK-z22nDMFcziFX2i-HWWpXj8jZmv8h3Si2TP7kiWKP3mAkXJEu1k2umYjm4A,Muji Pramono,https://play-lh.googleusercontent.com/a-/AOh14GiwkTapr1k_hRaDWqJ40Nr6dLGsS9Bv2eJVnn-w6g,"Metode pembayarannya ditambah lagi dong..... Pembayaran via DANA. Bisa?? ""Semoga Terkabul""",4,3,3.22.1,2021-12-07 23:23:07,,
gp:AOqpTOH8cFQE4Ih1jQ6udF54PSTs2MqB9ILR5kJFkm7b9P8QccnIIZFkJmxIkTt4uUupdYJD72tN_JTwJX2OUA,Nurazizah Zahro,https://play-lh.googleusercontent.com/a/AATXAJy3HupdwmYDlRMBdKPcpa7SMb9Lg9vGLhxHtr6P=mo,"bagus untuk pemula yg baru mau belajar dan mulai investasi ,sering ada seminar dari bibit jdi nambah wawasan kita tentang investasi",5,1,3.21.0,2021-12-07 21:32:14,,
gp:AOqpTOH7NjN-jATXAtlNPbvLz8RQ7OHjj_sErx_vwq1iACJe_1cYWhradMKCOAwy3vjEbBy-hxXZ1hvYJi8juA,Yoan Meilanda,https://play-lh.googleusercontent.com/a/AATXAJy3tnTxkR37-PElNU9Hu-EbzC-DjHKNhCQPzRWR=mo,Masukan kode ini klo mau dapat casback 25rb dari bibit??? ( kodesayaaja ),5,1,3.21.0,2021-12-09 01:47:45,,
gp:AOqpTOFsqzv-nAFFn--LfR-aoCOOOccltruqP9H71-dKfmi7lSNjs3JM9bzGDwCbxSVPgWoaqFBbN4DAdGhwBg,Wasis Muhammad Amri,https://play-lh.googleusercontent.com/a-/AOh14GiWFugtONn1dQFN8ouVHBtqUgDo0xxrLP3JxNws,"Uda setahun investasi reksadana di bibit Aplikasi yang bagus untuk yang mau belajar Investasi dengan user interface & User Experience yang bagus dan muda untuk dipahami dan ada fitur advise dari robo adviser yg bagus dgn cara menetukan Profil resiko kita, ayo berani dan belajar investasi skrng utk masa depan. dapatkan cashback 25k buat kamu dgn masukan kode refferal ""tanamkebaikan"" saling bantu saling untung.",5,7,3.22.2,2021-12-08 23:48:35,,
gp:AOqpTOEEAsNn8VOSu9x-ZZhXgNnRDStuaX76Lot0meuOSDiKWtR6se4XqymSZwXdSmpPjRO8U89xKGo_irzRBg,Aries Kurnia Sandi,https://play-lh.googleusercontent.com/a-/AOh14GiaR3jWLw28I3dGNHkIRjy4_eMK5-YEc0jKkxzazA,Kok aplikasinya ga bisa dibuka,4,0,3.25.0,2022-01-02 15:57:46,,
gp:AOqpTOEwAZWY1H-j_cpZtl_i2v-yKR4Gz7WPn50sUU2iONGPaHsDwiy_80853j7y9phhgiMnat4Ia6FKxgpC8A,Rizky Fauzy,https://play-lh.googleusercontent.com/a/AATXAJx06W38oYsL2TyYpMG2jJyj3w9wdPXGMcOK9CGn=mo,Knp pnya saya g bisa d buka ya,2,0,3.24.0,2022-01-01 14:41:14,"Hai kak, kemungkinan jaringan internet kakak tidak stabil. Silahkan gunakan jaringan lain lalu coba force close & clear cache terlebih dahulu ya. Jika masih terkendala harap langsung menghubungi live chat Bibit atau WA +622150864230 agar tim support Bibit dapat segera bantu lebih lanjut masalah kakak. Terima kasih
",2022-01-01 19:32:44
gp:AOqpTOH-xMgbKyHIaImTK5Fw8qE6unbswEwi1J8nUz_MYOCG9rKFVOXZC6TvasPQOX4gnGTt0P7sRwq-Mzlu8Q,Endah Pratama,https://play-lh.googleusercontent.com/a/AATXAJwHZsrRTJQ_BY3pWtgzEpkbh3895Wa5-eGcZXf2=mo,mantaaap . mudah digunakan untuk kita2 yang pemula di dunia investasi ðŸ˜Š gabung dan pakai kode referral saya : bibitkayayuk,4,6,3.22.2,2021-12-10 19:17:56,,
gp:AOqpTOEVE62Zc42z9_QOCU3RC1YlDHw4Act13vUySgl5cQhEBfFMsdFu_IuQZ33sXgZHwsvwxKjDPhczP0kBrA,MUSTARI MUSTARI,https://play-lh.googleusercontent.com/a-/AOh14GgKe38SwpOuiax58VzRSTi1yhS2aci3FvdJwJ0Nig,Semoga pilihan kita semua#Bibit,5,0,3.24.0,2021-12-31 19:47:34,,
gp:AOqpTOFeZnUXdQsx8cBjIJ20LA3rQBDLG2Di6XJe675ERuxrpTeziihHM4TYr9l2uRSlP2oTxOZiBMGMvbi7Og,Gatot Suherman,https://play-lh.googleusercontent.com/a-/AOh14GhAGM2GdvVgS7eNLYUn3lExayFYJOn55rCCgWylqg,Bibit Aplikasi yang sangat bermanfaat. Silahkan masuk Kode Referral : ghaniku biar kalian dapat cashback. Semoga kita semua sukses berinvestasi di Bibit. Terimakasih bibit...ðŸ™,5,1,3.22.2,2021-12-13 06:22:58,,
gp:AOqpTOEvubMtn3B_21hqY1sROHt0tK2Ti-P8RrjaP4h3q9hCPHCISwWGtAAktbT2H3SRRgR-zEkJQJ0Uyk6AsA,Miftah Hulfauzi,https://play-lh.googleusercontent.com/a-/AOh14GiuDeYXtI3ZXs-7NrsV4mwU5qtT-f46iq9-jd3n,Sampai saat ini cukup puas....,5,0,3.25.0,2022-01-07 10:52:13,,
gp:AOqpTOEpc6bJyMb_2i3FdXaa4opuTsHbApkEHzsZJfaa54RUulAbv-nPU-g7Sbdqf_-t3zg9cPziN-hh5FQBvA,Fidiphuu,https://play-lh.googleusercontent.com/a-/AOh14Gg4kgwh58yIPmD3WbQMOL4bLWXmH-YvXKbeASMeFQ,Gak ada kata terlambat utk investasi. Kuy.. Yg mau dpt cashback.. Masukin kode refferal : fidiphuu,5,4,3.18.1,2021-10-28 10:47:55,,
gp:AOqpTOFzD7Imq8JvKZbRxnlXSA1KEqk7aEG3-Kz0RdK9uihqF5jN416fcx3hEMt8qTQoehMUE4gRzmXz6gobRA,lydia wonk,https://play-lh.googleusercontent.com/a/AATXAJyMWdotB5mvpb162bMKBCSBSAuFFBeS00ZYltXe=mo,"Masih nyaman2 aja pakai bibit, walau investasinya pakai uang sisa belanja, lumayan, terimakasih bibit",5,2,3.22.1,2021-12-08 16:30:28,,
gp:AOqpTOGEEIUgn9sArT4jU1699SoRfU9Nv7cwmJeJx3gRdiFb8u9z-oAJeWklaXuF8SbO67B0LGqy-KQQ9OPlRA,BOUCAH YT,https://play-lh.googleusercontent.com/a-/AOh14Gjmb9-R_yIFfDFwQ3gM--7mfz6RFqSSZbSoj7w1,yang ga paham investasi mending gausah komenÂ² gajelas lah . makanya sebelum coba aplikasi serupa ya cari informasi dulu biar paham cara kerjanya,5,3,3.19.3,2021-11-18 06:05:45,,
gp:AOqpTOEK7rDvaM2hXLnEoMt0lund5rJi3_cm19_PKo7mzc1vW-2iK-pGtwzEiiMI8Wyaao8U9izUoJ4_e4gQWw,Husnul Yaqin,https://play-lh.googleusercontent.com/a/AATXAJxLE0Xqw9k8kZpMWRrbQDaxy4-RQxy6Wlk7xDzm=mo,"Naik saham nya 3 rupiah Turun nya 400 rupiah Gitu pun uda 2 hari gk naikÂ² malah turun teruss , Bagus simpan uang sendiri di rumah lah Untung aja baru top up 100 k untuk cobaÂ² ,",1,4,3.18.1,2021-11-02 18:32:56,"Hai kak, tetap fokus investasi secara rutin utk memperoleh harga rata-rata reksadana terbaik di berbagai kondisi pasar (naik/turun). Manfaatnya ketika pasar sedang turun akan terhindar dari kerugian yg terlalu besar. Info lebih lanjut hubungi layanan live chat Bibit atau WA +622150864230, tim support kami pasti akan langsung membantu kakak. Trims",2021-11-02 22:02:48
gp:AOqpTOFdtDWNbaCM9kaHPXhIuyv9Au6xwkdk0Zx4F_w3YhOI734wrRA4myb0aXJu6RDuCwvosyswEoJ_CuamLg,Abdi Zurianda,https://play-lh.googleusercontent.com/a-/AOh14Gjqm1a3tZjOvVQG-px8LM1gCJbaT99ntAt2ZsLp1w,"Yuk yang baru nyoba bibit, gunakan kode Referal ""Cobainbibit1"" supaya mendapatkan saldo Rp.25.000. Kalau tidak masukkan kode tidak dapat yaa.",5,1,3.22.2,2021-12-10 17:28:09,,
gp:AOqpTOEGyVJBEezDBYo2METI0B8wdRl7pPUzZISheFbQAZ1cu-wP5ZxlxqsDjWDSZMKyEHPi6g1vEh7Miv3Eqg,mr rose,https://play-lh.googleusercontent.com/a/AATXAJzLNdLcDCyWuWQv2bPOGLIF_8gRKS8u0LhNcs3V=mo,kenapa aplikasi bibit ga bisa di buka pas di cek di website nya jg ga jalan... mohon bantuanya..,2,4,3.22.3,2021-12-18 11:49:27,"Hai kak, kemungkinan jaringan internet kakak tidak stabil. Silahkan gunakan jaringan lain lalu coba force close & clear cache terlebih dahulu ya. Jika masih terkendala harap langsung menghubungi live chat Bibit atau WA +622150864230 agar tim support Bibit dapat segera bantu lebih lanjut masalah kakak. Terima kasih
",2021-12-18 17:59:35
gp:AOqpTOEk9GKgmcXwsdDjRdVCW47LKr2FSPTIQ0DPuOIRpyRMsrP6aOZ532AlORHR1xif27Pcecj7aXcYBUOs7w,Andes TUBE,https://play-lh.googleusercontent.com/a-/AOh14GhucREj7o1uqjTBDGJeIyVf239-u-yWwZ06sVStXw,"Aplikasi reksadana yg luar biasa, disini kita bisa menyimpan uang dengan aman dan tanpa khawatir dgn MLM, SUKSES TERUS BUAT BIBIT ðŸ˜˜ðŸ˜˜ðŸ˜˜ðŸ˜‚ðŸ˜‚ðŸ˜‚",1,7,3.18.1,2021-10-21 13:00:50,"Hai kak, jika memiliki pertanyaan atau mengalami kendala terkait Bibit silahkan langsung hubungi layanan live chat atau WA +622150864230, tim support kami pasti segera membantu masalah kakak. Terima kasih",2021-10-21 13:12:43
gp:AOqpTOGI5C4lwt43YxXRU7XKsyrlING5eP_w8mD7FUZQJGyjQsMG4JJIzyKVtieAQn_cnWs9vpCjge7a8v0Liw,Channel35 Uwais,https://play-lh.googleusercontent.com/a-/AOh14GhkSHMCKo34_TkFoGlidTfUR1-gGM93GBJ5CE6rvQ,Bagus sih aplikasi ini Heran aja sama yang kritis Emang pembelian dan penjualan reksadana prosesnya lama,5,2,3.19.3,2021-11-17 14:54:33,,
gp:AOqpTOFkRJ8wFfBAmSbzLqJUKt9wyOzTSFOgMlk0hgE8Qw6w6fxOdSwamyvYjIUyxnuXIljL3scCtJPgDm-5Fw,fairuz mustafa,https://play-lh.googleusercontent.com/a-/AOh14GjbvwehCxkVaGIwZOPmHoEMCIKB2hGyRKTlv7oZ,"kode referral """"elingwaspodo""""dapatkan cashback 25000,dijamin langsung cess...salam sukses dunia akhirat kawan ðŸ˜€ðŸ˜€",5,0,3.18.1,2021-11-03 18:25:11,,
gp:AOqpTOHpufjaCrm4n6yTga70ocpyQ4BJTRWwRCe2R0HOdiE3FJvJwxhRHansr1DXU9l6K8n81hyvSzNuLEop1w,Supian Putra,https://play-lh.googleusercontent.com/a/AATXAJwJXk5TG34FlKxUAgQz188yFMxhMgeeVzBrP3S0=mo,"Mulailah dari sekarang menabung dan berinvestasi di bibit,kalau ingin dapat kode promo masukin aja kode aqu(supian1)",5,7,3.18.1,2021-10-21 13:37:27,,
gp:AOqpTOED8L4TOW-Mk7zRULHF4n0NowoG8gHjDGwBHhliBBB4pbKXlViPghJcC6EWq2pH5wm9bdNOGwMrUPMOaw,Sanusi Abdurrahman,https://play-lh.googleusercontent.com/a-/AOh14GiENJ6yRla5Jdf1sYZvXP1HMB1wJp4UJOBuNgSc,Gunakan Kode Promo: sahabatjago Untuk dapetin cashback dari aplikasi Bibit.,5,2,3.22.3,2021-12-15 22:53:22,,
gp:AOqpTOH_Qs9mawuweKpBxYiSFTFPPYDACKUHhceboGNbLilSvEanYHjUZomqcuZwJQN-hbahz3zwp9tIlljJqA,mayang segara,https://play-lh.googleusercontent.com/a-/AOh14GgMX57-rW8lrc2o7Q-rtaO6bBRlK-I3WvEGU4b3ww,"Aplikasi yg mudah digunakan dan banyak cashback jgn lupa pake kode refferal mygse, biar dpt cashback;)",5,5,3.18.1,2021-10-22 03:06:00,,
gp:AOqpTOHxkO9AnokqCxkATa7JhUyu_pa8BOj0uQAho64zsQjqpzfKZRlR9TjsyNabHuR13K-oolKhWry-rcotEw,Cok Semara,https://play-lh.googleusercontent.com/a-/AOh14GgVMoqTD_eSn3dplCtYpiOvu7tBAPOo-sD2mcgEdQ,"Bagus untuk pemula yang mau belajar investas. Sangat recomend, karna karena sudah ada rekomentasi robo jadi mudah.",5,18,3.18.1,2021-10-20 18:39:07,,
gp:AOqpTOE4-330TZgO-_wp5c_300GsIYn2g_oImAXxKkkNMiKvr4RTrampDpbCoeNCFicxNFpSV3kXvsIVm1ruYQ,Aji Sarangkemasan,https://play-lh.googleusercontent.com/a-/AOh14GiSOd08NLS2fZcrLTBesY0-RMtBrGiLqis-MhOm,Investasi yang aman bagi pemula,5,0,3.25.0,2022-01-06 14:02:00,,
gp:AOqpTOE5vFmxv6Envx4Lgq3i4CBnbng-w5Iqzf4GfCSJl0rbl_AOWLoDxMf9qrKd-iwV5E7UedT6opjxj8YVUQ,Dimas Tauhid Cahyadi,https://play-lh.googleusercontent.com/a/AATXAJwVIq-RqegrpGOMEcez0GBTsh1Gln2eDRAEWJQ8=mo,"Aplikasi oke banget buat pemula dana keuangan nya diatur, masukin kode: dapatcasbackbanyak Buat dapat casbackk banyakkkk, pemula wajib daftar",5,4,3.21.0,2021-12-08 18:17:30,,
gp:AOqpTOGap0N_IrODqIT61auk5CKOWjCLiUpqBbzlFwaRkr_RBeFFTPtZaUyDkzXKqF9TAYRvm3MQGQdmlhuTZQ,Pitul Ganteng,https://play-lh.googleusercontent.com/a/AATXAJxYMqOmOkkAkHrzu0uZm0qBNHUNaqtkBrosV_Pd=mo,Pakai aja kode refferal ( nmvpsq6 ) nanti kalian bakal dapat cashback 25k dapat diambil saat pembelian.,5,2,3.18.1,2021-10-30 06:56:46,,
gp:AOqpTOHv4oK1ykphn-9KrXoO8ahHDxYD38il91pvjceYQjc_Qjnt1378rzQYY-Ew7i9zoFMxztcr_FC-cbIj4g,asep priyono,https://play-lh.googleusercontent.com/a-/AOh14GhxHan-5seHz_4jC5x6YZ4MWVt3juoBWKWF6jHvHA,Yuk belajar nabung saham di Aplikasi BIBIT,5,0,3.24.0,2022-01-08 13:14:50,,
gp:AOqpTOHVVc688kaGD-_PbbtCm053vUrogDuLwRYEsG474maL3QdelTaIAWMOqesvEUmSdKa7bS_L4QH58Httqg,Cimun Chan,https://play-lh.googleusercontent.com/a-/AOh14GjGN4pLJKq-9q846LNnwDyOxEAQX3-qD6-2J71N0g,Minus terus ya... Padahal investasi pake rekomendasi robo... Mau top up malah takut...,4,5,3.19.3,2021-12-15 14:23:04,"Hai kak, tidak perlu khawatir karena Bibit sudah resmi terdaftar dan diawasi oleh OJK dgn nomor surat KEP-14/PM.21/2017. Jika kakak memiliki pertanyaan atau membutuhkan bantuan, kakak bisa langsung menghubungi tim support kami yg siap membantu selama 24 jam melalui live chat/WA +622150864230. Terima kasih",2021-11-22 10:15:43
gp:AOqpTOGW1xFCbSoRtrNyijJidZbOEB85gngvhiuasFmPJcC-Wgt0a78dPnQxx5H-o4gFvGPK5nwLur5MQlTqKA,Insan Gaufuan,https://play-lh.googleusercontent.com/a/AATXAJyRkFagx9ZGn0tDN5iDsN6sjloTBxf-4i6Uvf9K=mo,"Bisa Dapatkan Cashback 25 ribu dengan code BIBITINSAN25 ..,.......................................",5,6,3.18.1,2021-10-24 04:40:18,,
gp:AOqpTOF4katlHVmENdsDFAGo2oCgYoDI6dIHaDpjDqZYMePfcU38uUgHqSNiPbgxvKggfNNSKCvmgS1e73W38A,Aen Suhendar,https://play-lh.googleusercontent.com/a/AATXAJxLNXJVqyHqG3yDtEajXGPDBOwwgNAEmzau74-9=mo,Temen temen jangan lupa masukin kode refferalnya yah biar dapat bonus 25rb. Ini kode aku (masukinkodeakuya),5,4,3.21.0,2021-11-30 17:03:32,,
gp:AOqpTOGFBcCPxI-AAO874SNUmxU8tz-3hnhFWaC7JP8aDL32pygQN9twUoYZWqt5JGWX7jexs4rSDytq4aDlhA,Moch Septiana Nugraha,https://play-lh.googleusercontent.com/a-/AOh14Gg0JyG_M3nDpHCpOGrInimf8mrG6BmBeV9xcl2nTg,Ko realod terus dari kemaren?,1,0,3.24.0,2022-01-02 11:48:02,"Hai kak, mohon maaf atas kendalanya karena saat ini sedang ada gangguan dari providernya ketika membuka app Bibit yang terjadi di beberapa user. Untuk kendala tersebut sedang dalam proses pengecekan team terkait. Kakak tidak perlu khawatir karena data kakak tersimpan aman KSEI dan dana investasi kakak aman tersimpan di Bank Kustodian :) Trims",2022-01-03 11:23:38
gp:AOqpTOHn8n9IO1KTw1FlZSYUtd6uuePi_8KcCgMSf5gJGRUY_kHHPmqesTkg7cORw8HiPhwYaH2BkadPEHXspg,retty eksa,https://play-lh.googleusercontent.com/a-/AOh14Gjl9l1-zvUIRbpe-KgjehlRtpj31oXjipEgmiIMvw,Pake bibit nyaman dan semoga tetap aman. Yuk yang mau registrasi pake kode referral eksabibit,5,4,3.19.3,2021-11-08 04:37:57,,
gp:AOqpTOFCuiPynl1wJnmC8ucrrrQI_zVq2B_YRjncc6eBjhdgRzofykP88MI6Bd3yUtvt2ZPjho5zBi--7l47_w,Marwan Gaming,https://play-lh.googleusercontent.com/a-/AOh14GjOy6raibhBOzaP8s_ilNXT7B032sVuJsv8HFGM,Udah bisa dibuka terima kasih,5,0,3.24.0,2022-01-05 20:22:20,"Hai kak, mohon maaf atas kendalanya karena saat ini sedang ada gangguan dari providernya ketika membuka app Bibit yang terjadi di beberapa user. Untuk kendala tersebut sedang dalam proses pengecekan team terkait. Kakak tidak perlu khawatir karena data kakak tersimpan aman KSEI dan dana investasi kakak aman tersimpan di Bank Kustodian :) Trims
",2022-01-03 10:14:43
gp:AOqpTOFNk25kMt5vo1g_A3tggne22Fmofa7sky--kSX2oUQNeJF1dSYYLvv9-dx3ckIOs53_KS3HTUnE8nwf-A,WALLYANTO SETIAWAN,https://play-lh.googleusercontent.com/a/AATXAJxjrN3paQ9jPz5yfRAHR50F3pdb_CxOEg9PKDoW=mo,Mohon lah untuk bank bisa diberi opsi ke DANA atau GOJEK lah...kasihanilah kami yang gak punya rekening..kami juga ingin berkarya,5,2,3.19.3,2021-11-09 18:53:48,,
gp:AOqpTOFnovEsrmSPD7scvR8IdRah30Vs-OyY73z2-0eSogreQhZgYctJxfdlM-MWe6RIeqbH7GoHr7gkHQ3KtA,Linda Agustia,https://play-lh.googleusercontent.com/a-/AOh14GjanVkgnJ-7m8ysH-1Z6uIdZeJ5zuo2HxU7FSryyg,"Aplikasi investasi terpercaya yang sudah diawasi OJK, gunakan kode referral lindaagt untuk mendapatkan cashback sebesar 25.000.....",5,3,3.18.1,2021-10-25 14:54:01,,
gp:AOqpTOGlcuBKSxnEa5vGemS9aCoHMXTa-mrgpMe5SrAc9P520KZpTwwxzmDwdoOFqONy2Ri5Rc5XWM6SeoanFw,Andi Prihandoko,https://play-lh.googleusercontent.com/a-/AOh14GgOxxjtYpNOrgHZp5hgMPmusILY8GQLHuPK0pXnhg,Apk eror gk bisa dibuka....,3,0,3.25.0,2022-01-03 08:21:18,,
gp:AOqpTOEuFnfAO1eZJWhWYHxn4U9YCRRy9du2BFnkKOokyNwrDXqVwYcwjlpWDyjQ_oSqUVC4mVVab_1G3ch2dg,Karlina Liana,https://play-lh.googleusercontent.com/a/AATXAJw0EhqDQh47Z-WByoMbfJS1hsF7YvcPKNUSJfzm=mo,Profit invest terbaik serta aman karna sudah mempunyai izin legalisasi dari OJK? semoga semakin baik untuk kedepan ya,5,3,3.22.2,2021-12-10 02:15:28,,
gp:AOqpTOGlLSIdjzNMZ2tDoak8rRCGYxfyf7s8T6nQAJTjx9riAKWaIn7RKdDRiypOarONzc8TuRLDU7bDdYiC8Q,Ramdhan Rachmadi,https://play-lh.googleusercontent.com/a-/AOh14GgA7Uh1P3XG-gej8rkCcAIMbBNCspjFRYA6AFSD8A,LAMA BENER MINTA KODE VERIFIKASINYA tolong Di percepat verifikasi Email nya!!! gimana sih!!!,1,3,3.19.3,2021-11-06 11:09:11,"Hai kak, untuk verifikasi email bisa klik kirim ulang email verifikasi di halaman atas menu home, buka email dari bibit yang dikirim ke email kakak dan klik tombol verifikasi yang ada di email. Info lebih lanjut hubungi live chat Bibit/WA +622150864230, tim support kami pasti akan membantu. Trims
",2021-11-06 21:36:43
gp:AOqpTOG9UsSGQFYHK_vzdstJn-2dM6qqeqzoWWIfhM6n2ZfKQfc1i1O5q28lEkdds3zZ6Qx7ENoNM6GaYSyLqw,afif aldi,https://play-lh.googleusercontent.com/a-/AOh14Gi0oYvDfUkbAsLNGPvtJ6o_EJt0pon_30zlRiL2Fg,Bisa kali pake kode referral nih = f1qlnfo,5,0,3.24.0,2022-01-01 12:37:40,,
gp:AOqpTOGoUqwSMAYICnROIRpYHpY2diXz-OHZi1OlW8D3VXsx8FNVps_gvQrMmTD_sltkwMBhshManLtgermt6A,Anggy Fasgiantoro,https://play-lh.googleusercontent.com/a/AATXAJyT6gyCLZCizzBx8ZBIHPrfuhcaCL22-jBeBSug=mo,Jangan lupa pakai referalku anggymf31 pastikan anda mendapatkan hal yang menarik Nabung disini aja ðŸ˜,5,2,3.19.3,2021-11-10 18:36:57,,
gp:AOqpTOGEeblESOVmlicaSgz1t9wQEmGYcjZkqn4GxUZPI9e4zpkVoQWkyuq0bVKWQmWwH4KxKLlvNQe7DS98YA,Adiyaksha apriyanto,https://play-lh.googleusercontent.com/a-/AOh14Gg4qzTJ6rxATYui62gr2XUmn52wUFn730YyjrFG,Penarikan lama. Disitu tertera maksimal 7 hari tapi sampai 10 hari dana yang masuk cuma 30% gatau sisanya kemanaaa,1,4,3.19.3,2021-11-05 10:16:05,"Hai Kak Adi, utk pengkreditan dengan bank penerima yg kakak gunakan sampai saat ini memang ada keterlambatan dari pihak bank tsb. Mengenai hal ini kakak juga bisa konfirmasi ke pihak Bank Neo ya, namun tidak perlu khawatir kami tetap akan bantu pengecekan ke Bank Kustodian. Info lebih lanjut hubungi live chat Bibit/WA +622150864230. Terima kasih",2021-11-05 11:02:37
gp:AOqpTOGWxxazKhrG_9qLftccSofQXb0d33s68AzzpHpkeIi5E9SwGzA5n9YWZjjMworBVrZUIY1eRRzcpwiG3A,Amin Sunhaji,https://play-lh.googleusercontent.com/a-/AOh14GhZyfhwNhO1UbVbiKQUFrb1sKMFeTxcUxNL-965,"Baru juga investasi dapet cashback dong, kodenya masukin aja ""bangrekber"" itu kode guys Mayan cuk dapet Rp 25 rbu beneran. Cobain dah",5,1,3.22.3,2021-12-21 14:26:53,,
gp:AOqpTOFhqjDjhUTPAlzVOToPr5LImD5NKPhVEE06SMW-BA4kJKmS2IdL5w2usVmO5biYkJqV1sa46VPGLny4nw,Dandi Satriawan,https://play-lh.googleusercontent.com/a-/AOh14Gh9cZsmWbD_FlJrha9aAjf3XMIUOCRVGFyWQBUZ,"Bagus banget bibit jadi gak ragu lagi investasi apalagi di usia muda seperti ini, aplikasinya juga mudah untuk digunakan",5,4,3.21.0,2021-11-28 18:00:28,,
gp:AOqpTOFXJds13aIM5QAZn-F9w79QbWZ5gxdavi6Z0LSyVOFmudAMQOzh5U-q7H3fEoF5KBUEnRjl8Z_65eEzVw,Ready 1212,https://play-lh.googleusercontent.com/a/AATXAJxGWcM_kq0iqiHjyxjwveU9_HJLAQSrP6_OClwz=mo,"gnnbmj9 - ini kode refeal, dicoba dapat 25.000",5,0,3.24.0,2021-12-26 12:04:09,,
gp:AOqpTOFPp0V74rQjAZGC-LXheH4IWKaNpeRSuPm1XMrV1usRu4ncs0jGFgUpRAGDyXeSPLDWBrkpLGsD5inCfw,RENI RAHAYU,https://play-lh.googleusercontent.com/a-/AOh14GhJ8x6IOMJwWXxJwPIcOmxJDMlIqoHCe_Vl5wJI,"Batal hapus semua data"" saya apabila ada penyalahgunaan data untuk kedepannya saya tidak segan"" melaporkan ke polisi",1,3,3.21.0,2021-11-27 20:08:06,"Hai kak, akun bibit tidak dapat dihapus karena sistem kami terhubung dengan sistem KSEI dan sistem KSEI tidak mengijinkan kami untuk menghapus akun kakak. Bibit sudah mengikuti standar keamanan untuk lembaga keuangan dan menyimpan data dengan menggunakan enkripsi AES-256 yang umum dipakai oleh lembaga-lembaga keuangan lainnya. Terima kasih",2021-11-29 03:43:29
gp:AOqpTOF_9jeoEOVbwjFWnEsmzSh2XcxidW-ceOVXDyk2OrCYut_OWV0PfFd0zxksEQXxD6Is7FFr8Pg3N6mVpA,Rahmat Karim,https://play-lh.googleusercontent.com/a-/AOh14GijDwKqsj6H9SUYu-H82x8hQ9S3dhjc9inxqiKIJA,Kecepatan dalam bertransaksi pembelian atau penjualan bisa lebih di percepat,4,2,3.22.3,2021-12-16 15:48:09,,
gp:AOqpTOFIryMskMsCyf7ENMcHompSo7ZlmsSiTApirL4KCZ-kYrcQ6BPC3-OCYduHB4PFDHb8MEFt2MJLZJHSLw,M. Hardi Danar Adiguna,https://play-lh.googleusercontent.com/a-/AOh14GiC7SrochvZf2Rdul26-8LJvQj-U2g9-tFB9OeVaw,Akun bank BSI ko gak ada ya min?? Semoga kedepannya ada yaa. Jadi belum bisa inves karena pake rekening BSI,4,1,3.19.3,2021-11-11 12:22:35,,
gp:AOqpTOGDeHpua6ijpUWe4LQdx9h6KY3uEXodgS1B5qM-eKCcAK0Z3vz5oaoa67S1jTFzUd_n8IIDxHiApbiQfg,NOVI OKTAVIA,https://play-lh.googleusercontent.com/a/AATXAJyA85jhlhzpU6OWOhrf6WPh0wbOHVG7_epn_ZOs=mo,"Yuk pakai bibit sangat mudah digunakan untuk pemula.. Referalnya jgn lupa ya => ""pastidapatbanyak""ðŸ˜Š",5,3,3.22.2,2021-12-12 10:37:54,,
gp:AOqpTOGuipUHSXrBVQG7_XpR6fHCjXmPzIanb5v5z2wGk_Qz-MZDumENk-_9BXHczUOTIYqW8i0VWP6YnfefVA,hahaha Barbar,https://play-lh.googleusercontent.com/a/AATXAJzObO5ewFuOzdKPb-MfEtEWHHeur1v21XF64Bc=mo,Parah aplikasinya ...jgn download...cs nya malas kerja...nyesal investasi disini dh lama cs nya bot,1,2,3.22.3,2021-12-16 11:16:51,"Hai kak, mohon maaf atas ketidaknyamanannya. Jika memiliki pertanyaan atau mengalami kendala terkait Bibit silahkan langsung hubungi layanan live chat atau WA +622150864230, tim support kami pasti segera membantu masalah kakak. Terima kasih",2021-12-16 12:09:02
gp:AOqpTOGpuF0OtYBTQcDqzss8fBnbHtGqYqHSA11zysYgq7LlG4goJkVsIVhjswqlUvxkgJdbTPXA-6uts6cYVA,wisnu kusumah wardhana,https://play-lh.googleusercontent.com/a-/AOh14GgfgBnf4_Udi1GH2h4bNcnkdTG1WEzlKgK7ffaQ,Tidak cocok sebagai tabungan jika dibutuhkan keperluan mendesak karena proses pencairan dana bisa sampai 9 hari kerja sangat lama,3,6,3.18.1,2021-10-24 21:56:47,,
gp:AOqpTOHznALnKFt8ZSxkVSuzsjtot61aIb6A2gMk7FD13hH1DvKPo6tdM2bvCW2yjA97FdzEuz79vrTsjqYALQ,Tukang Bersih Bersih,https://play-lh.googleusercontent.com/a/AATXAJzLO94U6l7w4DIaKFOeajgg593JwHYjhyHoy6Aa=mo,"Aplikasi yg yg mengubah pandangan tentang finansial untuk selalu berhemat ... Pake kode referal "" setyaki "" Dapatkan 25rb cashbak",5,0,3.22.3,2021-12-20 02:44:58,,
gp:AOqpTOEENtg325nI-WHQT_BLQ-7rTjmkVBIYVCYIObwBPYPG7nCD8HNGNQed8K1Py5BdoRCbmvR3I5Oh3On25g,handi apriarizki,https://play-lh.googleusercontent.com/a-/AOh14GjJPn-P79N7qCn08tIw2ZODtv23SKFdCjwgrZicYg,"KTA,prosenya cepat dan lancar",5,0,3.25.0,2022-01-05 00:35:26,,
gp:AOqpTOGFJDyCM2X88p8KJ44Nqj9c2kMIGodXRl-520pWJNbNEYpf9DXpRJRj4uAsfNmhBeKb8G7y928on8khHQ,siti aminah,https://play-lh.googleusercontent.com/a-/AOh14GgFts0AbPC1vwS6rjllJch3MFBAVlYINOuQ4GAdbQ,Kenapa saya gak bisa login yah?,5,0,3.24.0,2022-01-02 13:14:27,,
gp:AOqpTOEfm9cWGy0CMXs81aDjzATN0CsinOKXkIRHxxmvYTA70Sc8m5uZx5F6uNKAI7EXtaVNEKx19REq2XLIKA,yudha ape,https://play-lh.googleusercontent.com/a-/AOh14GiG9BYiJP719qT346V-Ezlm_H8HAiqbmaUeyevKQw,Sangat buruk dan kecewa haha,1,0,3.25.0,2022-01-04 17:01:42,"Hai kak, jika memiliki pertanyaan atau mengalami kendala terkait Bibit silahkan langsung hubungi layanan live chat atau WA +622150864230, tim support kami pasti segera membantu masalah kakak. Terima kasih",2022-01-04 18:23:15
gp:AOqpTOEZyaQikz285P0l8cn9gNreuvp2mwXaLSsaoh6GT5x-eifaZBXydQuJcodd-CSueNAvXFYYZ6lNXt06Cw,Fachtur Rachman,https://play-lh.googleusercontent.com/a/AATXAJy-Qj3kcxV6KA8GeBwJ3U8KK1mdHWQDmwGHkXEG=mo,Halo bibit saya mau nanya saya kan masih di bawak 17tahun nah saya mau ber investasi apakah bisa,5,2,3.18.1,2021-10-31 22:37:52,,
