reviewId,userName,userImage,content,score,thumbsUpCount,reviewCreatedVersion,at,replyContent,repliedAt
gp:AOqpTOFY2uYj0yccHUqDWQCpFsjxQDmedvHVKVppvb9QY99rAeu4y5vilTxu4fPaEHdIuA1MBelE22FZ2YLnvw,Lala Indriani,https://play-lh.googleusercontent.com/a/AATXAJwNvyucU7G0mNf1fpsrkbrhrhdkGNpLfhzE4MEv=mo,"Saya sangat suka sama aplikasi ini, anda hanya perlu isi referal MEMORI, saat awal Anda daftar dapatkan bonus menanti anda. Aplikasinya sudah sangat cukup baik, tidak ada kekurangan, hanya saja untuk penarikan tolong di percepat sedikit supaya lebih lengkap keunggulan aplikasi ini. Untuk pengawasan pun sudah baik karena OJK yang mengawasi, pokoknya ia the best lah buat aplikasi bibit.",5,61,3.25.0,2022-01-11 07:56:29,,
gp:AOqpTOEtWeEJYVO46fvAhx3yB2oLF6uy8adxPDzQJz306BjcpFiDkSSb3BD9pyDy8huPgUueGtPGE01iEAP5ZA,Madan Mix,https://play-lh.googleusercontent.com/a-/AOh14Gj78VQCvPHmZoQ0hkQaxs6HojwjBdx3p3yB73WSjQ,Maaf buat developer.. Saya mencoba menjual investasi saya senilai 100 ribu.. Malah yang masuk cuman 37 ribu.. Sisa nya di kemana in Tolong kejelasan nya.. Saya mohon kembalikan sisa investasi saya senilai 63 ribu.. Karena uang senilai itu sangat berharga bagi orang yg kurang mampu seperti saya..,2,107,3.25.0,2022-01-12 10:23:26,"Hai kak, pencairan dana ditransfer langsung dari Bank Kustodian setiap produk reksadana bisa saja berbeda waktunya. Jika dana penjualan blm diterima & sudah batas waktu dari tanggal Order Jual Berhasil (3 hari kerja utk RD Pasar Uang & 7 hari kerja utk RD Saham dan Obligasi). Silahkan langsung hubungi live chat Bibit/WA +622150864230. Terima kasih",2022-01-12 11:17:40
gp:AOqpTOHMLNLjhpiCvp8NvBeJLi3VTsOCwQSQ9GAEb7hF3vPkr6sm5e2wYJPrxe80u-l1OKxtKYT-V90FGd9rQg,IKA,https://play-lh.googleusercontent.com/a-/AOh14Gj5V5vSnn3n6DT5LWELkywM4_QQ5vJf2ZxDKrgKOg,Saya diajak teman daftar banyak keuntungannya. Pertama sempat ragu tapi saya puas dengan hasilnya. Daftar aja gunakan reverensi saya !!ORDER!!dapat bonusnya.<!!!!!!!!!!!!!!!!!!!!!!!!!!!!!!!!!!!!!!!!!!!!!!!!!!!!!!!!!!!!!!!!!!!!!!!!!!!!!!!!!!!!!!!!!!!!!!!!!!!!!!!!!!!!!!!!!!!!!!!!!!!!!!!!!!!!!!!!!!!!!!!!!!!!!!!!!!!!!!!!!!!!!!!!!!!!!!!!!!!!!!!!!!!!!!!!!!!!!!!!!!!!!!!!!!!!!!!!!!!!!!!!!!!!!!!!!!!!!!!!!!!!!!!!!!!!!!!!!!!!!!!!!!!!!!!!!!!!!!!!!!!!!!!!!!!!!!!!!!!,5,504,3.24.0,2021-12-26 20:43:47,,
gp:AOqpTOEJLdiOIu7m6-HgKdaM-dm_3DKAX1FXrbk1r2UusmfN6xUEGP0ryH_x_Z0rLN_ESIh-DQ7eNJde9JRTGw,Prastiwi Alivia,https://play-lh.googleusercontent.com/a/AATXAJz0DjOjQdeUUkpxddSc6RYzznSReQ8sQTEaO-hg=mo,"So far puas pake bibit. Tapi ada beberapa kekurangan yg sebaiknya segera diperbaiki; 1. Ketika masuk aplikasi tidak ada diminta password, jd sangat rentan jika HP hilang atau dicuri, takut dana yg sudah diinvestasikan disalahgunakan. Aplikasi sebelah rata2 minta password ketika mau masuk aplikasi. Bisa jd bahan pertimbangan buat pengembang 2. Setelah lolos verifikasi MI dan pembelian dinyatakan berhasil, tapi di laporan imbal hasil prosentase masih dikalikan dengan saldo yg lama ðŸ˜…",4,184,3.24.0,2022-01-04 08:34:13,,
gp:AOqpTOEk8IolHDCQbaZVyf4PfT2zZbnMvBpX4eYiRzmMHRqM1YdR-lZHXY9-V0I_mNV2M51bfVB-5ni4Lcv4Rw,Star Ciribel7,https://play-lh.googleusercontent.com/a/AATXAJy_p55JtsIEMWuz-8H-tO-vMErZg0Aj61O1br3v=mo,"Aplikasinya bagus untuk investasi pemula. Kita juga bisa mendapatkan cashback sebesar 25.000 menggunakan kode referal ""kastara"". Ayo gais gunakan kodenya dan mulai berinvestasi",5,3,3.25.0,2022-01-11 19:30:29,,
gp:AOqpTOFNf71barJe3suXcKFfkFUyFuZipIk6Gp4JRZudQLWbWVwkZoMxQz-qXHngBHCEowzjlOZdXx6BSC4BJw,POVly,https://play-lh.googleusercontent.com/a-/AOh14GgWJO3wldogt1Q4ncnNpHzvwnQiC8qcBiIapWXHsQ,"Terima kasih Team Apps Bibit, sekarang saya sudah bisa masuk lagi ke Aplikasi. Saya berharap kedepannya aplikasi ini lebih stabil, jadi pengguna bisa lebih tenang bertransaksi. Saya yakin uang tetap aman karna di Bank Kustodian.",4,13,3.24.0,2022-01-03 12:34:20,"Hai kak, mohon maaf atas kendala sebelumnya. Kakak bisa coba kembali akses aplikasi Bibitnya saat ini. Jika masih kendala, harap langsung hubungi layanan live chat aplikasi Bibit atau bisa juga melalui DM Instagram @bibit.id maupun messenger FB untuk dibantu pengecekannya ya, tim support kami pasti segera membantu masalah kakak. Terima kasih",2022-01-03 12:25:21
gp:AOqpTOFnI-PC1lNe41Ep88gXiH30MwhxJ5NhjJ0l876JswP2RjD2qrEEBhVNO2MKOByFFB8jzIYKRaDp6PfwRg,Desti Nurhayati,https://play-lh.googleusercontent.com/a-/AOh14Ghe99er4rYDRwgZpCL9pd-fAU2jb-L_gjHekKOwCHM,"Aplikasi reksadana yg bagus. Emang sih pencairan dana bisa sampe seminggu atau lebih, tp saya gak masalah krn tujuan saya nabung jangka panjang, cairin dana baru 2x. BUAT KALIAN YANG KOAR2 DANA SUSAH CAIR PAS URGENT PLISSSS BELAJAR LAGI TENTANG INVESTASI!! Nabung tuh jangan semuanya disimpen di Bibit, nabung juga di bank biasa buat persiapan dana urgent. Investasi tuh buat jangka panjang, bro sis. Kalo mau jual reksadana gk sampe 3 bulan invest, gausah soksoan invest deh.. Anyway Thankyou Bibit!",5,101,3.24.0,2021-12-29 21:30:07,,
gp:AOqpTOHg9amJbig4ALELHkSHW4hu0AtselS6lfH9jUnHalmoGYjcakpaOeLPk0QFjbUJxEtQ-qm9r5L65HP1QQ,Sri M S,https://play-lh.googleusercontent.com/a-/AOh14GgqRo9CoK2hPpC0G2Qt2I4oD7273s0tNY2BsE17,"Terimakasih Bibit.id, setelah mengalami kendala tidak dapat mengakses Apk nya, sekarang saya sudah bisa menggunakan Bibit.id hanya dalam waktu 2 jam terjadi kendala, skrg berhasil melakukan top up kembali, setelah sebelumnya saya chat WA resmi Bibit.id dan koment ke IG Bibit.id respon CS nya cepat.",5,34,3.24.0,2022-01-03 11:56:58,"Hai kak, mohon maaf atas kendala sebelumnya. Kakak bisa coba kembali akses aplikasi Bibitnya saat ini. Jika masih kendala, harap langsung hubungi layanan live chat aplikasi Bibit atau bisa juga melalui DM Instagram @bibit.id maupun messenger FB untuk dibantu pengecekannya ya, tim support kami pasti segera membantu masalah kakak. Terima kasih",2022-01-03 11:41:58
gp:AOqpTOETEBHsGxJPqXiJj4Cl0WIT60SAysjEb0VqkdgBXbouCgmInsKb7VFL0BOjmOT4em2Uo1aFrmXVxzxNjg,Rahmat Ramdhani,https://play-lh.googleusercontent.com/a-/AOh14GiW12OxspB617hdyRc8hMaRLMEXd7iNLfk3jYmB,"Mantap bibit, awalnya tampilan aplikasi agak berantakan setelah di update, kemudian dpt pemberitahuan email untuk hapus aplikasi dan coba install kembali, akhirnya aplikasi aman dan lancar seperti biasanya. Terimakasih tim bibit untuk respon dan tanggapan keluhannya. Maju terus.",5,50,3.24.0,2022-01-03 11:47:10,"Hai kak, terima kasih atas feedback yg diberikan. Saran ini akan ditampung dan kami diskusikan bersama tim. Bibit akan terus meningkatkan pelayanan & inovasi karena tujuan kami membuat investasi menjadi mudah untuk masyarakat Indonesia. Jika ada pertanyaan kakak bisa langsung hubungi live chat Bibit atau WA +622150864230. Terima kasih",2021-12-27 08:06:39
gp:AOqpTOGeS3awUfTlpl8i7mEGjE_H5MbnFNcN3Hz_Uq-315j3b3ygvDqjljaKA2okNHVu3XqhgWiCKtWwZXSp8w,Tria Saputra,https://play-lh.googleusercontent.com/a-/AOh14GgUI3NVDiyJD9jLE9ePWR7rgv39Z6BDY2VcDVLz,"Masih tetap tidak bisa masuk ke aplikasi, selalu saja halaman web tidak tersedia. Kenapa ini tolong segera di perbaiki jika memang ada masalah, ini sungguh sangat mengganggu saya. Mengingat saya sudah memakainya beberapa kali namun sudah sedari kemaren kemarin selalu sajantak dapat masuk ke aplikasi",5,77,3.25.0,2022-01-03 02:51:52,,
gp:AOqpTOF52XVfKDoy0e_u60cujKT28ACfyGcZ1UNEM2Vws5E6elW9gnpigNOjOlQ-ciZHnabCQpxlXsg3jeyNCA,Ahmad Aqil,https://play-lh.googleusercontent.com/a-/AOh14GjfNlF_UI4myr7VPfcIvaG5TBKI8gDrQU_u_KVkjQ,"Sedikit saran, tolong tambahkan fitur catatan pengeluaran pemasukan uangnya catatan keuntungan sebelumnya dan setelahnya, mudah mudahan bermanfaat bagi sesama pengguna bibit, karena jujur saya sering merasa kesusahan mengingat berapa keuntungan ataupun kerugian yang saya dapat sekarang",4,82,3.25.0,2022-01-08 15:11:43,,
gp:AOqpTOEfymzhE7fiCOuosHRsIzTmo3x2yNAfy5r-rnM8gDxGjIxArzmweaPn46rZ9GiWXPqL1IEEuYSC0NzDfQ,dicky anwar,https://play-lh.googleusercontent.com/a-/AOh14Ghl_9ClbKpzY2QF6oS0sJQ-F3YsmastAa7_LmnH,"Invest pake robot 100rb, mau di WD 100rb lg, yang nyampe ke rekening g utuh Klu ada pajak atau apa di kasih tau, jangan asal potong aja Dasar develop, pngen untung sendiri aja Kapok invest di bibit Kebanyakan rugi nya",1,4,3.25.0,2022-01-12 21:55:12,"Hai kak, terkait dana penjualan kakak akan mendapat potongan biaya admin bank jika rekening yang kakak gunakan berbeda dengan rekening Bank Penampung reksa dana terkait. Biaya ini adalah kebijakan bank terkait, bukan dari Bibit. Info lebih lanjut hubungi live chat/WA +622150864230, tim support kami akan segera membantu kakak. Terima kasih",2022-01-12 23:40:38
gp:AOqpTOGScxFcfwURT_nDAF704PFUwgd0BeJkSAwwgOIt3PvX919BtQDigcWTp-Tzvu7UkkH9uEuHYE7k20elxw,Abizhar Yunus,https://play-lh.googleusercontent.com/a-/AOh14GikdZfLLxIxfBCofxbYxZ0y5VlYDCwDCeg4EhUVtw,"Saya mau nanya , apakah apa bila order sudah berhasil di jual , apakah otomatis masuk ke rek kita? Apa bila memang sudah masuk ke rek kita kok saya cek mutasi tidak ada pemberitahuan ya terkait dana yang masuk ya mohon penjelasannya kak ðŸ™ðŸ™ðŸ™",5,15,3.24.0,2022-01-03 16:46:46,,
gp:AOqpTOGKMG5BVEEtsLiB3c5f7EeyJzJSt-XurJusBaYcpgcRa5Ea2-UZIvp0wuUUjQF9txanZ855ZQbkPRYItg,Mohamad Sahrul Ali Akbar,https://play-lh.googleusercontent.com/a-/AOh14Gi6qiMNwOkd1LVgqsJ5n6oKoZa-1X9iLJXZYXykCg,"Min punten,tolong dong diperbaiki masalah Jangka waktu pembelian/penjualan,verifikasi akun,tarik dana.jgn terlalu lama.ini adalah fasilitas yg harus bibit berikan kepada kami agar kami nyaman dan senang menggunakan app ini,karena inikan udah jamanya moderen jadi kita butuh pelayanan dan fasilitas yang memenuhi standarnya moderenisasi.ðŸ˜Š Klo ada salah kata mohon maafðŸ˜",3,80,3.25.0,2022-01-08 20:25:35,,
gp:AOqpTOE-hKeaWHVIaEDKFFZ9Hs-ZCARzhE9GYrKNiHW5Gy4VNirqNiJv39fulpkdIOsVei_JLDC2SYVQ_icNIQ,FUAD,https://play-lh.googleusercontent.com/a-/AOh14GhHDuWt13ggODO-yhyjyKTvayCL0aEwhDo85oM04w,"Sebenarnya aplikasi ini bagus, sayang cuma dalam transaksi jualnya sangat lama bisa lebih dari 6 hari dan jualnya tidak sesuai dengan harga jualnya ketika saat waktu awal dijual, padahal sebelum jam 13:00 sesuai aturan rulesnya, selaku customer agak kecewa sih",3,71,3.24.0,2021-12-27 22:21:18,,
gp:AOqpTOHsczbNcLGmVypEstsQCC8hlWx7wxOw63WJDxHB4rxUm91j7OBmw53ipP9JQtDqxsc21V6dORmtHw6aBQ,Hiding Hunter,https://play-lh.googleusercontent.com/a/AATXAJw-b3TMhprUBZJSBtM6bnKXo-D7u-e2uYqA_nmv7Q=mo,"Aturan setiap 22:00 update grafik tpi bisa 2-3 hari ga update pdhl bkn hari libur. Knp gk bisa real time grafik nya, kan jdi gk tau dlm sehari itu menit mana yg NAV terendah, lbh enak stockbit. Fitur robo jga gk bisa hilangin opsi saham, utk invest kecil klo ada saham 10% yg minus pun jga lumayan, apalagi grafik gk real time makin gk tau ini saham posisi naik atau turun, hrs nunggu besok, itupun klo udh di update. Tau sndiri naik turun nya saham gmn. Bisa rugi terus",3,131,3.23.0,2021-12-23 15:44:48,,
gp:AOqpTOGKaQbwT1J6R1ijDqSPPAKDYwIdjkcDY7iGCqfX2Yix0YM3-AfgiinJH9XImF1jFnzp9WJ91yjQ3RJQNw,edhi djunaedi,https://play-lh.googleusercontent.com/a-/AOh14GgDpQ8BCATKKtZzcq2IQ8mnHlc-51iQ5ix1PBtx,"Saran saya..kalo bisa untuk pencairan jangan terlalu lama...soal nya kan orang pasti membutuhkan dana darurat yang bisa di cairkan dengan cepat. misal untuk biaya berobat atau yang lain nya..,ðŸ™ðŸ™ðŸ™ðŸ™",3,15,3.25.0,2022-01-06 08:38:54,,
gp:AOqpTOGGi6A44h3S8Ql4yScAQvfidZFRqeLeCaLfFPEtJ8HX6MeN_Fx4XUMr3StUBHmS_CDGahNudw-USrtdUA,Ferra Shirly Amelia,https://play-lh.googleusercontent.com/a-/AOh14GjgYhWUHz6OAbf6qSTgI97ICM4KrhVm967jJRyV1g,"Bintang 3 dulu. Padahal sebenernya aplikasinya bagus banget. Tapi sayangnya, saat jual gak bisa real time. Harga saat jual naik, saat pencairan udah turun. Next semoga bisa real time macam Bank digital. Sayangnya,, bank digital belum ada yg Syariah. Jadi sementara..bibit masih sy pakai",3,74,3.23.1,2021-12-22 18:46:00,,
gp:AOqpTOG_PSMbkGJRbjed3Am9LjIDp2GH6_-V8YYDOxJ7gMAZFZZdsVvhZv8dZq_5AZRoDybCqUSem1VjU1v1Sg,Febri Anggraini Entertainment,https://play-lh.googleusercontent.com/a-/AOh14GhE7qpEfmUHV0dOKp_FSnXnX_ryXBl0k-kNPoV7Mg,"Mantap.. Tapi sayang, ada. Kendala saat saya jual reksa dana pasar uang dan obligasi dana nya gk masukÂ² ke rekening padahal sudah 7 hari lebih bahkan samapi 2mgg lebih gak masukÂ². Sudah saya wa namun. Blm ada jawabanya... Saya tunggu besok, selebihnya mantulll kenaikan juga cakep.. Keren lah pokoknya. Kekurangan nya itu ajah sih makasih bibit..",3,161,3.24.0,2021-12-27 02:10:02,,
gp:AOqpTOEwlF4CrqICDuoq19A2VAoccAz1cEbQTUkSayraX5ZNxNL1XMsS0pD_GQjHr_f1kpZU3KY5nbgpBb79ag,Kyousuke Hasegawa,https://play-lh.googleusercontent.com/a-/AOh14GhT6bjh_ojqE1HDN-KyRXXsNnWWSC4dgxMIDWIE,Tambahin juga dong metode pembayaran dan penerimaan hasil jualnya dengan DANA dan virtual account Bank Muamalat. Untuk saat ini untuk jual beli Reksadana yg bisa bayar dan terima hasil jualnya lewat DANA baru B*******K. Mudah-mudahan kedepannya disini juga bisa. Karena bisa menghemat biaya admin.,4,162,3.25.0,2022-01-07 05:57:43,,
gp:AOqpTOHYMfbW-_CV6k-TEpb5tmzWfcs3xK47yDq4fipZjU938pvwVZ33-4uHWfzeJhXglwrcDebVXEPzzWFoyA,Jhonanta Egik Maulana,https://play-lh.googleusercontent.com/a-/AOh14GhsafAe15_H6k2e0zw-PwoPSM2xgsdPL5AtSWMCRA,"Baru kali ini saya berinvestasi di Bibit rasanya nyaman dan bagus bngt buat para pemula yg ingin mencoba menabung dll. Dan kekuranganya adalah dalam pembelian dan penjualan itu memakan waktu 3 hari baru reksa dana masuk ke portofolio dan biaya admin terlalu besar juga.puffft Suskses terus buat Bibit kedepannya semoga menjadi lebih baik Trmksh salam cuan,salam sukses",5,7,3.24.0,2022-01-02 23:30:13,,
gp:AOqpTOECWAng6B315C2SKjw6kUYzY6BMfHQwRjLpaWKcmIETfacHjF9JQywGnviiwbgHn3imZsTQgsQyBE39pQ,Ø§Ù…Ø§Ù… Ø§Ù„Ø­ÙƒÙŠÙ…,https://play-lh.googleusercontent.com/a-/AOh14Ghbq7yy2DWLPAU0ZuuLo1IGhf6wjE42LP8AM36m9w,"Sebenarnya sudah bagus, cuman saya minta saran kepada aplikasi bibit untuk proses pencairannya bisa di percepat lagi? Mana mau bayar hutang alhasil lewat jatuh tempo jadinya, karna kelamaan nunggu caerrrrr ngga sekalian atuh 2 minggu terus sebulan pisan",5,142,3.25.0,2022-01-12 02:09:36,,
gp:AOqpTOERkwYXw07MLkz4E5hYjQ3kW0LdZdeg3KCDUsSJ3pjZ0x4hr_62avcCFQzc1UfJBnhXPNlvRKjp_Cz3zA,RUSTON NAWAWI,https://play-lh.googleusercontent.com/a-/AOh14GgeOb1xYoKIOpHJPfmMDKI3q6XOp_gf54sxU4bWIw,"Dari tgl 30 Desember ampe sekarang 3 Januari 2022 kenapa aplikasi bibit saya ga bisa ke buka, padahal dana saya masih ada di sana,udah di re install juga tp tetep soperti itu kenapa ini",3,5,3.24.0,2022-01-03 06:51:32,,
gp:AOqpTOGrbFn82ULAgN2V1TESrPQrlwSbXf7T7BJ1eeMj2XLRSdITcFyngiUrqR5WRMHOq4dnCC9DIVL_EHqVwg,Ardan Fyrmansyah,https://play-lh.googleusercontent.com/a-/AOh14GiTh2I73GSm7Bkacc_uGzbb0eQUDavkmym12jxrbg,"Halo Bibit, Kapan uang Top-up masuk ke jenis reksadana yg saya Top-up (Modal Investasi)? Saya Top-Up sudah beberapa hari lamanya masih tersimpan di ""Pembelian Baru Kamu"", butuh waktu berapa lama agar nilai nya masuk dan bertambah ke modal investasi karena saya telah Top-Up?",3,203,3.25.0,2022-01-03 10:52:05,,
gp:AOqpTOGG1LJsUc9zKf5xL2tK4Bz3Ic27kXLwms9t97k6hZ80vbzMSAX1cnxTEdUrwjMqSNqsiweqol8rxe_o3A,Febby Pattiruhu,https://play-lh.googleusercontent.com/a/AATXAJxrlJlRJckhIzF-peuj1Ez_GCgQNb5voLXvmZTh=mo,Hallo kak... Sudah 2 hari aplikasi saya tidak bisa terbuka nih. Sudah di-update pun tetap tdk bisa terbuka. Padahal udah dekat jatuh tempo menabung rutin ðŸ˜­ðŸ˜­ðŸ˜­,4,3,3.24.0,2022-01-02 09:10:28,,
gp:AOqpTOG0JyP0pVnFFm1K4DdKIl47Mip1SJ0xzXM-U0Arz2OMc1alshSl56GPZjcZo4DTRv-_OOZxqlSJCbJ1OQ,Tri Utomo,https://play-lh.googleusercontent.com/a-/AOh14GjXJw0VPqhvUuHv1PM3UkyB42ksWemAqMQF3koN-Q,"Mau nyoba invest, malah Gak bisa log in Terus knapa ya? ðŸ˜­ padahal coba saya apus data Ulang, sampesaya instal ulang malah tetep Ga bisa Masuk Ke aplikasi nya ðŸ˜­ kalo udh bisa masuk lagi nanti saya kasih 5 Stars maap buat 1 Stars nya",1,7,3.24.0,2022-01-02 12:09:30,"Hai kak, mohon maaf atas kendala sebelumnya. Kakak bisa coba kembali akses aplikasi Bibitnya saat ini. Jika masih kendala, harap langsung hubungi layanan live chat aplikasi Bibit atau bisa juga melalui DM Instagram @bibit.id maupun messenger FB untuk dibantu pengecekannya ya, tim support kami pasti segera membantu masalah kakak. Terima kasih",2022-01-03 11:33:28
gp:AOqpTOHdA9D8Xqd4O3DMm2x8r1PKHnhskXBSnAuy6ZkAnR4YuvgO774ElD9_ztPmagj_oY4iOCjdxITxyyX1yA,Kecoa Terbang,https://play-lh.googleusercontent.com/a-/AOh14GhCjlBaGZVGCyEGOm9y6BxsPyxDh2i0-cWgk-keFQ,Proses pembelian/penjualan masih terlalu lama min. Tolong di percepat lagi ya proses sistemnya:) terimakasih Sejauh ini saya suka sama aplikasi ini ðŸ‘,5,0,3.25.0,2022-01-13 11:34:06,,
gp:AOqpTOGAGrQpMnHXR4f1LW3M72bg0jsE-KgJBarxW3DLYYaUaWj_xsFeX5hePxEX6o98qbj8f93E6oyXAFucyw,Renaldy Maha Putra Setiawan,https://play-lh.googleusercontent.com/a-/AOh14Gg2ES3tEQVvUorHd25qrGJzVYrtjc06ZxktpyKSjg,"Cocok banget nih buat pemula yang mau belajar investasi. Masukin kode referal : renaldymps , buat dapetin 25rb , semangat menuju financial freedom",5,0,3.24.0,2022-01-02 19:16:26,,
gp:AOqpTOF0QO2poiCn5-QiokVCAe7njQxfSi299yL2m9yIYp_VhSZlLMJr626oc-jIXhzFR7LlyKVn9w54xgaBNw,Opi Kristian,https://play-lh.googleusercontent.com/a/AATXAJxuGeVwqybY17oZ0s3daaGvBDLIkqokcmkLd1Is=mo,"Bibit erorr ya, sejak kemarin akun saya kok gak bisa dibukak ya, kok jadi takut saya, mana sudah isi saldo lagi, mohon penjelasannya admin, sama kalo mau komplain kemana ini ....??!!!!!",1,30,3.25.0,2022-01-03 00:16:11,"Hai kak, mohon maaf atas kendalanya karena saat ini sedang ada gangguan dari providernya ketika membuka app Bibit yang terjadi di beberapa user. Untuk kendala tersebut sedang dalam proses pengecekan team terkait. Kakak tidak perlu khawatir karena data kakak tersimpan aman KSEI dan dana investasi kakak aman tersimpan di Bank Kustodian :) Trims",2022-01-03 09:59:41
gp:AOqpTOFc6PemypG3xjG__YjJ9kd0hAB2sPFZH5CO2eyZUsCzbZkaCwTZc33lVQcv7FA0TGpiR3hoUw3guI7dmg,Yuyu Sukses,https://play-lh.googleusercontent.com/a/AATXAJxP-b--pIOInrz5xy1ua8DBiduTaW6Wp_qTZZAP=mo,"tgl,29 Des 2021 jam,13.36 mana kata nya mau di proses di hari sama maksimal 2hari kerja , ga jelas tuh Harus nya bibit punya team, orang2 propesional utamakan nasabah jangan mengutamakan kepentingan diri sendiri.",1,6,3.24.0,2022-01-03 15:35:55,"Hai kak, untuk transaksi di atas 13.00 WIB akan diproses di hari kerja selanjutnya. Berdasarkan waktu yang kakak infokan, pembeliannya diproses di tanggal 30 Des dan unitnya masuk di tanggal 3 Jan (31 Des Libur). Info lebih lanjut hubungi layanan live chat Bibit atau WA +622150864230, tim support kami pasti akan langsung membantu kakak. Trims",2022-01-03 16:41:10
gp:AOqpTOGv1laAO9uaLJPyp1U13VA5BX-Cu3jGhf60WBGGAp46tkv0c94hY2FDR9pFRemrWtVaYiZhIoL7BqC6Jg,gilang arrasid,https://play-lh.googleusercontent.com/a-/AOh14Gi82hTSL1ZFTGfBaV-TfozG3pepI57Nye7In7_R,"Fitur-fitur untuk berinvestasi menarik dan simpel ðŸ‘ untuk kedepan nya metode pembayaran nya di perbanyak lagi seperti Dana dan bank lainnya, selebihnya untuk sekarang mantap laa ðŸ‘ðŸ”¥ jangan lupa masukin kode referral : Ikutialurhidup biar dapet cashback semoga cuan ðŸ’ªðŸ”¥",5,2,3.24.0,2022-01-05 11:25:17,,
gp:AOqpTOFILr9LVyNXvqUwAubfOovoWeUsBxpy4veS9lgFIt5r07EXcOKhoWiYvStjK7yBFqFVsvKad8_TiaClxQ,azpxy,https://play-lh.googleusercontent.com/a-/AOh14GgGlrTNhWqs2P5SlEWYxrzlsTFEYqQSIIPcBwwQ,"dibanding aplikasi investasi yang lain. ini salah satu aplikasi yang enteng dan bersahabat dengan hp lowspec. tapi masukkan saja, tambahkan fitur mode gelap atau dark mode. supaya lebih enak dalam penggunaan handphone ketika remang-remang. terima kasih tim bibit.",5,32,3.25.0,2022-01-05 17:19:38,,
gp:AOqpTOFyi-sVYxJ_B7ZtTb32saCcnOwttSp5STJSq7uZkw6yrP7whq5h7ldlhRS3f5tjboqroHTKyHgHHZAYKg,Gery lintang Dewantoro,https://play-lh.googleusercontent.com/a-/AOh14GhOcvbWTw3DoSWfejU2ZLQo2KZaI6wziJln0fDhFg,"Wahay pihak bibit, kenapa bibit saya tidak bisa di buka, di layar tertulis halaman web tidak bisa di buka, apa masih dalam tahap perbaikan hari ini saya melihat hal tersebut apa ada masalah yang terkendala?",5,7,3.25.0,2022-01-02 21:17:32,,
gp:AOqpTOH_o0X1JBsseKFRvU0K8QjyCYjx3lChCV6akWD0GIe7ErK-aWVNniYQcckcZ7NoEWfL4GnAYKAXAJMreg,semua ada,https://play-lh.googleusercontent.com/a/AATXAJyG4ceBfRNo5gCkiKELGZqN92ZY3pLWD2bfnTB8=mo,"Info: yang mau mencairkan sebaiknya dari jauh"" hari solanya jangka pencairan hampir 2 Minggu ya dari pertama penjualan bursa kerja, persetujuan bank konvesional, sampe pencairan dana sayyyy, jadi gak bisa buat dana darurat",5,75,3.24.0,2022-01-05 18:01:03,,
gp:AOqpTOF6Isimr8pYlPPw7IdTKLnxYJ3a4_T2x7-AkVmruhFbW-rHFdZTqs6y_XdwN-sZHuiFmnbjyA-RwDxBLQ,I Made Darma,https://play-lh.googleusercontent.com/a-/AOh14GjG6cYLkfEGbWn8PPtvewho_NDr2yBUWI5LXdOs,"kenapa. bibit awan tahun 2022 , kok ndk bisa di buka dipalikasi aku.....apa yg terjadi dgn bibit ?!? sudah 2 hari bibit aku ndk bisa di bukan akun aku?!? OJK sih OJK , tapi kok kek gini , parah memang",3,9,3.24.0,2022-01-02 19:29:22,,
gp:AOqpTOEFqaOT1ATpgk60f5KGLLolDaV2kyb7svORkDBSS9Z1JGdAJBJlOVakbYCNOHR9yxwiPWZGNw0LY50qHQ,DADIL DAY,https://play-lh.googleusercontent.com/a-/AOh14Gj5uWkGT48kqks_-aJz8Ky8r1lVerPt6vBDMBiw,"Bismillah moga ini jadi awal yg bagus buat belajar saham,saran sy untuk tambahin metode deposit dan penarikan via indomart/alfamart.jujur itu solusi tepat untuk orang khususnya pelajaran seperti sy yg blm punya rekening bank mau pun apk untuk transaksi online,Terimakasih.",5,49,3.24.0,2021-12-30 01:32:46,,
gp:AOqpTOF5waTzzPmbWwxdplPPuK8BZf2y1drefvMTDLlDIIOnZttm07OPyCdgiLKLDcsCBkc1mtI_vQrZdjPkoQ,Mono,https://play-lh.googleusercontent.com/a-/AOh14Gi3z2NlRWecjnUM0NDiaR-6pS2lpnJLAYSE8mQz2g,Sebulan nyoba investasi di bibit cuma sekali dapat keuntungan 0.01% setelahnya selalu rugi 0.3 - 0.6%. Jadi curiga dengan system keuntungan dan kerugian nya. Moga aja kecurigaan ku ga benar.,2,1,3.24.0,2022-01-02 10:56:59,"Hai kak, keuntungan dihitung dari perubahan harga atau NAB reksa dana. Jika NAB naik maka keuntungan kakak akan naik, begitu pun sebaliknya. NAB dapat berubah mengikuti keadaan ekonomi, suku bunga & kinerja Manajer Investasi. Info lebih lanjut hubungi layanan live chat Bibit/WA +622150864230, tim support akan langsung membantu kakak. Terima kasih
",2022-01-03 10:51:54
gp:AOqpTOHHfnJBs1KPud5a2JQudr9w6UYmzjYn00L1vlPZAzbRGYMHlJ2Ll_QhZtmK5OB-q_HXSs_QQ8ZVAFoRhQ,JefryKtut Yadnya,https://play-lh.googleusercontent.com/a-/AOh14GjJzL0mSZF1L5URl_-zgm6o3T8uEe___fRl7oE2UQ,"Mau investasi tapi aplikasi tidak bisa dibuka berkali-kali padahal koneksi stabil baik menggunakan Wi-Fi maupun paket data. Sudah switch jaringan, masih saja tetap tidak bisa dibuka. Mohon tindak lanjutnya yang profesional. trmksh",2,66,3.25.0,2022-01-02 21:45:21,"Hai kak, jika memiliki pertanyaan atau mengalami kendala terkait Bibit silahkan langsung hubungi layanan live chat atau bisa juga melalui DM Instagram @bibit.id maupun messenger FB untuk dibantu pengecekannya ya, tim support kami pasti segera membantu masalah kakak. Terima kasih
",2022-01-03 12:21:56
gp:AOqpTOGzQiW1fIut7sXdsfQT4R_I31AGNGCVUSMxYsY80-RsTZYU67aSmRiT7TmX6nuCRtBLrlplbQ7lKlVMUA,Frisca Valenzia,https://play-lh.googleusercontent.com/a-/AOh14Giqkzb5k-RoppPP4Z1-F_yiKUiOdsnPIDmqC-o,"Kenapa ya hari ini aplikasi bibit dan website bibit tidak bisa dibuka ? Saya sudah uninstal lalu instal ulang dan uprgade aplikasinya tapi masih tidak dapat dibuka, bagaiman ya solusinya ?",4,2,3.24.0,2022-01-02 13:46:32,,
gp:AOqpTOHO2dlSra4cJMx8OhaC9tt-qyCM6IR1O_0GOMzLA-vXgE-IK8zQKuwxt7QxyVXD8dYBH7sDlcNnV2iI4w,Dea Aginingtias,https://play-lh.googleusercontent.com/a-/AOh14GhXo_zZw31CkF_F0HxDTBi0sxjEX4XQen_9snu5og,"Ini kenapa baru download pertama tapi lamannya ga bisa diakses,belum juga masuk baru pertama kali mau buka ga bisa terus. Udah di uninstall terus download lagi tetep ga bisaa",3,0,3.24.0,2022-01-01 19:45:16,,
gp:AOqpTOG9QMbkvQl8LtodYmhNegI3RmpfyEMG0TH69u_9kCIAxxGVbkockJdYUwLNgMocYfl1byUnC8aE65_oUw,Muhammad Raffi,https://play-lh.googleusercontent.com/a-/AOh14GiKD6vpd3yuRA8dnUwC5jzmjB4n4UBnWOIpTWXMjQ,Min saran. Tolong tambhkan wallet dana juga donk. Biar lebih lengkap lagi kalau mau setor/ top up. Saya sebagai pengguna dana kurang puas ketika cuma ada pembayaran via gopay dan linkaja. Coba tambhkan dana. Otomatis penilaian di kasih 5 bintang.,3,63,3.25.0,2022-01-07 13:07:23,,
gp:AOqpTOGIG6tti_u9Oy07ATZ93TlwYn2jddRQtDcjJ_TbSKX_SVDUYrfaUdaLGJBSg-CFuzT3cPKn61zaxH1dgw,ahmad aryanto,https://play-lh.googleusercontent.com/a-/AOh14GiOihjxkPyWm8A-uAYOHLij3VuLdsCq6gbVRcSL6w,Saya udh jual saldo tidak masuk masuk sudah 7 hari kerja. Aku buka trus bibit nya malah hilang akun aku. Aduuhh harus hati hati ajh ini takut nya yg udh udh engga Mao terulang lagi,1,0,3.25.0,2022-01-09 12:38:38,"Hai kak, jika dana penjualan kakak belum diterima dan sudah melebihi batas waktu 7 hari kerja dari tanggal status ""order jual berhasil"", harap langsung hubungi layanan live chat Bibit atau WA +622150864230 agar tim support kami segera membantu untuk konfirmasi ke Bank Kustodian. Terima kasih",2022-01-09 16:13:45
gp:AOqpTOEg1yntImDpShWmJJmEeUXfL4nK45Eo8dWonQnaj_SihSrzJV-dL8eT6weBsoBpep_7kFlpiRUJqaQCCg,Kevin Tim,https://play-lh.googleusercontent.com/a-/AOh14Ggff1bt9qOJk1iYHWXMdTVnzuMT9ybuY_BstyR1Ww,Tolong regulasi nya di pangkas dong. Kelamaan tuh waktu untuk masukin modal nya kalau butuh 2 hari. Apalagi yang masukin nya hari Jumat sore.,1,0,3.25.0,2022-01-11 18:12:37,"Hai kak, pembelian dan penjualan reksa dana memang tidak realtime, karena membutuhkan proses verifikasi dari Manajer Investasi. Transaksi hanya diproses pada hari bursa yg berlaku di luar Sabtu, Minggu dan Libur Nasional. Info lebih lanjut bisa hubungi layanan live chat Bibit atau WA +622150864230, tim support kami akan membantu kakak. Terimakasih",2022-01-11 18:59:38
