reviewId,userName,userImage,content,score,thumbsUpCount,reviewCreatedVersion,at,replyContent,repliedAt
gp:AOqpTOEjmN0MSG1EsuEVBQlMzPwsh8tKv2z1OQwdWY9u0lxkpnKxUID_Axi0rKUo9gGxSKaNhFiG5SXWa-rmzQ,DUNIA ANAK,https://play-lh.googleusercontent.com/a/AATXAJxW3q0sOzKbMcXW6hBpnbOJmzhTF_1jCfRMbpDD=mo,Investasi kalo jual portofolio cairnya lama nunggu 1 minggu ..mending di pluang,2,0,3.24.0,2022-01-05 06:26:13,"Hai kak, dana penjualan dikirim langsung dari Bank Kustodian ke rekening terdaftar di Bibit sesuai ketentuan OJK maksimal 3 hari kerja utk RD Pasar Uang dan maksimal 7 hari kerja utk RD Saham & Obligasi. Jika lebih dari itu dana belum masuk, hubungi live chat Bibit/WA +622150864230 agar tim support kami bisa bantu lebih lanjut. Terima kasih",2022-01-05 08:08:47
gp:AOqpTOE3SSn-_cP7EBmE8wDr-FfKBvAJ6YGVpdNIhjE8WK8mB1-znDyjyCmtsrxZ8h77pd76l7BBGJzhw4tKNQ,Ahmad Triwahyudi,https://play-lh.googleusercontent.com/a-/AOh14Gho3ws-8nZ837CUiyqsHvMaqRhihBXb5k_UW44p,"Saya witdraw saldo saya ga masuk semua,hanya sebagian doangðŸ˜¥ padahal di status transaksi bibit sudah berhasil semua,tapi saya cek di mutasi rekening yang masuk hanya sebagian",1,7,3.22.2,2021-12-24 00:57:55,"Hai kak, dana penjualan dikirim Bank Kustodian ke rekening terdaftar di Bibit sesuai ketentuan OJK maks 3 hari kerja utk RD Pasar Uang dan maks 7 hari kerja utk RD Saham & Obligasi. Jika lebih dari itu dana belum masuk, hubungi live chat Bibit/WA +622150864230 agar tim support kami bisa bantu lebih lanjut. Trims",2021-12-24 08:52:45
gp:AOqpTOEvE8b5bU8nrAaMDm0YXfrNPu5k3k7WuQ0ag7MiLFCtOYJ_gHXnsYV4t1gB9OgSW7d_Rqsk_jiskZtQWg,Naufal Aa,https://play-lh.googleusercontent.com/a/AATXAJzHXuIpb51aNxFCHqLTbHHOixoXvofziNzLUy8o=mo,Jangan mau kalian nyimpan uang disini. Aplikasi bobrok. Duit saya hilang di tarik ke rekening.. Sampai saat ini nggak masuk masuk janji 14 hari kerja.. Udah di sabarin. Nggk masuk juga,1,17,3.19.3,2021-11-16 19:07:21,"Hai kak, jika dana penjualan kakak belum diterima dan sudah melebihi batas waktu 7 hari kerja dari tanggal status ""order jual berhasil"", harap langsung hubungi layanan live chat Bibit atau WA +622150864230 agar tim support kami segera membantu untuk konfirmasi ke Bank Kustodian. Terima kasih",2021-11-16 20:03:57
gp:AOqpTOGZ-z-B62bLXR-J7L88gOaslO7F6bglHw81C9dQDsJ3LOF3kYvw1vGEIDBfmRgIuE_cdg-1mhTaL1X5Xg,Tri Windarti Setianingsih,https://play-lh.googleusercontent.com/a-/AOh14GgcWdDNE1ikMAZ7BI7bNYf4IpOdWNLHlel17ojw2w,"Maaf sebelumnya kalau memberi bintang 3 dalam ulasan ini, menurut saya aplikasi ini sangat bagus dan cocok untuk pemula banyak fitur yang mudah di pahami, namun entah kenapa aplikasi ini tidak bisa digunakan bersamaan dengan aplikasi google chrome, jadi google chrome harus di uninstall dulu baru app bibit bisa di pakai, untuk yang sering menggunakan app chrome ini sedikit mengganggu, semoga kedepannya bisa ditingkatkan lagi, terimakasih",3,67,3.19.3,2021-11-18 00:03:51,,
gp:AOqpTOGBE2wJRfdX5x3PV-o1XBeI_qNJXimE_HMlHLDhWUqRP20aQGfohKPh6rkQzUz1C3PpFhjWaDZAU2bkMA,Depra,https://play-lh.googleusercontent.com/a-/AOh14Ghx0nuFlt1XiRHVDmxkb8dEJm4M16FUfuxIJewfPw,"aku bisa , selagi ada kamu yang selalu menemaniku . . ðŸ˜Œ",5,0,3.24.0,2021-12-30 11:29:29,,
gp:AOqpTOHtVVaY6atiAvvNqNQ7vxSSmTzFrHcX0_BSdIAI76vrk5mkP8NMHeBtYhkqulGnnaS6fJ4f8unMlkMC1g,Mutiara Wati,https://play-lh.googleusercontent.com/a-/AOh14GjCBmcWqgW5lRiXLONCBj0lXZMjO9OD6x8zZScyWg,"Suka sama aplikasinya, bagus untuk pemula yang mau belajar berinvestasi. Saran aja, agak dibanyakin lagi untuk produk reksadananya. Mulai dari rdpu, rdo sama rds ðŸ‘",5,3,3.19.3,2021-12-14 22:11:49,,
gp:AOqpTOGC6S90QcLWdc3fh5wqYu4SR4_oAgfImVHS6GrErruTeHEbJEBsTViQzH2AxnJt_8r5ihVLDxIW0U636g,Mr. bar2,https://play-lh.googleusercontent.com/a-/AOh14Ggh4kLo8iYpy3Vt4-mcQ8G07dnSb99O_ScexeS0,ko uang nya gak masuk ke rekening yah udah seminggu lebih,1,0,3.25.0,2022-01-12 21:01:02,"Hai kak, jika dana penjualan kakak belum diterima dan sudah melebihi batas waktu 7 hari kerja dari tanggal status ""order jual berhasil"", harap langsung hubungi layanan live chat Bibit atau WA +622150864230 agar tim support kami segera membantu untuk konfirmasi ke Bank Kustodian. Terima kasih",2022-01-12 23:38:42
gp:AOqpTOFEjWLbTXy-MIxAGzBv6aP1ieF5SNmvWK7SYQKNMM8pr2IwzTC8pbSAq48_x7RqLGOSIp3bixpCShZf-Q,Yuslisa Mariani Amalia,https://play-lh.googleusercontent.com/a-/AOh14GgQo-NNkG5BrMf4CByAGCwbSp5XoF_a-GBgLnqmow,"Padahal baru mulai, tapi saat mau mendaftarkan akun saja sudah lama prosesnya. Terlebih kode verifikasi nya tidak dikirim-kirim. Padahal biasanya mendaftarkan akun melalui apk tidak seperti ini.",1,45,3.18.1,2021-10-27 05:33:53,"Hai kak Yulisa, terkait kendalanya pastikan internet kakak stabil & nomor hp masih aktif ya. Registrasi akun bisa dilanjutkan dgn login menggunakan nomor terdaftar, lalu kirim OTP via misscall (4 angka terakhir dari nomor misscall adalah kode OTP). Info lebih lanjut, hubungi tim support kami di live chat atau WA di nomor +622150864230. Terima kasih",2021-10-27 14:01:40
gp:AOqpTOEkGRVhy-cdVhLOkgnRx3IIKLQhO0l8wv-BCtyTT0LwdqHqFs-cMp1Fx82NtKTuuX644pyMtjpnHfaFQw,Irsyad Al Fikri Ys,https://play-lh.googleusercontent.com/a-/AOh14GgdleRJJZFzfiqj8LLa84qhrZPvq12wmv1A_Ep89Q,Masukkan kode referal (jayanegeriku) setelah menyelesaikan pendaftaran dan dapatkan cashback 25.000 setelah melakukan transaksi pertama. Ayo cuan bareng ðŸ™‚ðŸ˜,5,8,3.22.2,2021-12-18 12:36:39,,
gp:AOqpTOHZnr6VVVhF4oQP15kk51763NJCTL4NnTI0OxZQQAJnRcJYCFC2lMCTT92LBwE5jJOsRIgaF7YBsQ1KKg,Raka 27,https://play-lh.googleusercontent.com/a-/AOh14GgrXEQQmbrCLsXHXEM1z6jXnrewbgHyIdfHdobfAw,"Aplikasi gak bisa dibuka, tolong dong Gak bisa dibukaa",5,0,3.24.0,2022-01-02 00:15:49,,
gp:AOqpTOFPTEts-FRR5DI3g4prPAp2AudYDUwT-WH731H4AQESTCZ9Wv3NWJ6pLQACId2QTXIrfHsRuLfcj8R_kg,Nanda Anggahari,https://play-lh.googleusercontent.com/a-/AOh14Gjxfhkg1buyJ3zmoYLWt0qe_uE2nZSSWdF0Uchcwg,Terimakasih bibjit sudah menyediakan aplikasi dgn tema bibit investasi. Terus terang sya. Baru pertama x ini ber inves. Untk ke depanya mohon bimbingan nya. Krna sya masih pemula dan awaw,5,21,3.18.1,2021-10-29 02:04:26,,
gp:AOqpTOHy-zRv6mGmCT-a0F9AjfZ22xNeCZRb_UD3ob1hNIZ1b6NhucXaePpeQmPxFHOPhekPOseSeSTy4bz35w,Fahrul Baihaqi,https://play-lh.googleusercontent.com/a-/AOh14GghjsRpuJjrGy5POxqsfvmUZCSihh9izSim55qVjA,"Sumpah gk jelas, qw investasi 100.000 eh malah berkurang jadi 97.000. Mending taruh bang ada bunganya dr pd berkurang kayak gini. Apalagi proses WD lama banget, masih kenak pajak pula, sumpah gua NYESEL bgt instal apk ini",1,19,3.22.3,2021-12-21 12:54:00,"Hai kak, investasi ibarat seperti sedang memulai Bisnis, tidak ada kepastian untung atau rugi. Untuk dana penjualan dikirim Bank Kustodian ke rekening terdaftar di Bibit sesuai ketentuan OJK maks 3 hari kerja utk RD Pasar Uang dan maks 7 hari kerja utk RD Saham & Obligasi. Info lebih lanjut hubungi live chat Bibit/WA +622150864230. Terimakasih",2021-12-21 14:37:31
gp:AOqpTOGZdOqr6Q4LtCv6DvBa6Q2nXoBrI5iG9nS0VnGPGDlox34HS7Tn2KIBmWGs1RVhSeYaIq6Ses0T3TwBIg,Tedi Nurulhadi,https://play-lh.googleusercontent.com/a-/AOh14Gi7DkWNPC_HHlAX6_mRx3e1n72oz8_8NNwKFEh4,"Verifikasi lama, di tolak karena foto ktp blur... Tidak seperti yang lain yang memberi solusi mudah, ini di suruh ke dukcapil untuk upgrade e-ktp. (Mohon maaf kalo bisa semudah itu, udah saya lakukan dari dulu.dan untuk data2 lain di e-ktp saya pun masih jelas ko, hanya di bagian FOTO saja yang blur)",2,75,3.21.0,2021-12-07 12:25:02,"Hai kak, jika foto di KTP kakak sudah blur bisa dibantu dengan bukti pendukung berupa SIM/Paspor ya kak. Namun jika tidak ada, kakak bisa update KTP terbarunya ke dukcapil agar registrasinya dapat diproses. Info lebih lanjut, hubungi live chat Bibit/WA +622150864230 agar tim support kami bisa bantu lebih lanjut. Terimakasih",2021-12-07 13:07:15
gp:AOqpTOGV9aWgOQvnvqi-CgCyyoqQnz3AjLLXPJoCsYjDQAkvVJYopB9QD1hG5J_UQq1RPSqyBrz6IsFlzF8Afg,Jhon Saragih,https://play-lh.googleusercontent.com/a-/AOh14GiJIgnWko-hHKdcle-vHshYsWhnuVJnsLuCSFJd7Q,"Di Ajaib gitu tarik dana langsung cair, di Bibit, 1 minggu dana belum juga cair.. Berpikir lagi deh kalau mau investasi di sini... Asli semua serba lelet di saat yang lain serba cepat..",1,53,3.19.3,2021-11-23 09:34:29,"Hai kak, dana penjualan dikirim Bank Kustodian ke rekening terdaftar di Bibit sesuai ketentuan OJK maks 3 hari kerja utk RD Pasar Uang dan maks 7 hari kerja utk RD Saham & Obligasi. Jika lebih dari itu dana belum masuk, hubungi live chat Bibit/WA +622150864230 agar tim support kami bisa bantu lebih lanjut. Terimakasih",2021-11-23 11:10:10
gp:AOqpTOEN6w_QS-IhI6IjZlshdAfZh3KdQXKaEJuYL5_FWdiB5MEI3FpS3XfUMERgYZIJ5wh-VeO2HnqOzeWOBA,Agung Nugroho,https://play-lh.googleusercontent.com/a/AATXAJymczPRrxIiRlNwJepPB3hGaMkcEmY0m5UDIlNi=mo,"Dua kali instal ga bisa dibuka aplikasinya stuck di logo bibit doang. Udah coba uninstal, clear data,instal ulang,restart tetep aja ga bisa dibuka",1,8,3.22.3,2021-12-18 14:44:10,"Hai kak, kemungkinan jaringan internet kakak tidak stabil. Silahkan gunakan jaringan lain lalu coba akses melalui browser di app.bibit.id. Jika masih terkendala harap langsung menghubungi live chat Bibit atau WA +622150864230 agar tim support Bibit dapat segera bantu lebih lanjut masalah kakak. Terima kasih
",2021-12-18 18:00:32
gp:AOqpTOExz4-3n8zFvtEjTaRnZAoixLwtpdwzEcqK-PUPi2gBeOEFKkrrkD3loCSD5w4UvuOZgIo8ohhaRoVkLg,Alif Maulana,https://play-lh.googleusercontent.com/a/AATXAJyNvdpi2TdS521fPT3CR3QicNhc_zIc-ZBzvL-a=mo,Tolong ini kenapa saya mau masuk ke aplikasi gagal terus,3,0,3.25.0,2022-01-02 21:08:52,,
gp:AOqpTOGoMRfNlVRvW36jtt5XU7sw1tVbloB__SNWndsKUyO4c2BEhXnlbANWhWrdyrCILde-nAoR-AxKzwNyzQ,David Nababan,https://play-lh.googleusercontent.com/a-/AOh14Gge8wPm1eaXy-yq03voowr1EdBDiDQsHdlLAMjkVQ,"Aplikasi investasi data tidak akurat Ringkasan Performa Phorthopolio berubah ubah Modal investasi dan Total Pembelian sering berubah ubah dan tidak sama,tranksaksi yang sudah selesai lama dan tidak ter update,pantesan minus Mulu orang ngak di update,ketika di tanya pengecekan Mulu.",1,22,3.19.3,2021-11-19 10:00:13,"Hai kak, investasi ibarat seperti sedang memulai Bisnis, tidak ada kepastian untung atau rugi. Jika kakak memiliki kendala pada transaksi reksadananya, silahkan langsung hubungi layanan live chat Bibit atau WA +622150864230. Terimakasih",2021-11-19 11:29:57
gp:AOqpTOHw-KNn7W3mKnFuC4pBv84lvhLO37d-sKXx6jRd9vuGNDzWPo2frp1D-tq-wZ2RBzV6UBEleBy90n_I3g,Muhammad Hildan ãƒ…,https://play-lh.googleusercontent.com/a-/AOh14GjLRPempfWSIOgkIgZXQf4Y4wr6B80BkwUvxPD9gw,"Aplikasi nya sangat bagus mudah untuk berinvestasi, dalam bentuk saham untuk jangka panjang. Jangan lupa untuk memasukan kode refferal IdannnUntuk mendapatkan saldo awal 25 ribu di akun yang Anda buat",5,1,3.19.3,2021-12-02 22:06:32,,
gp:AOqpTOEklgBW8yCd3tIv6pMiydoBcTyd3cChgMiw7R_4LcETN1Wlpsxtz2uNs_SXUfbQzsWlhnc5365huaR31A,MariaUlfa Official,https://play-lh.googleusercontent.com/a-/AOh14GiVHWl8pY2LLM6gwWtpZZX_Q0_R0gru-sAVkdPp7Q,"Aplikasinya saya kok gak bisa dibuka lgi yak, kenapa",3,0,3.24.0,2022-01-02 12:00:02,,
gp:AOqpTOH0EeP2ItJI8k9X9Xvfa1ag0K7zOAfH2iR7wiDCuqXr49XrI8IYOKOWjbYr4cHd4KEZ9maACLTvKXmTlw,Alvia Fathiyatur Rizqy,https://play-lh.googleusercontent.com/a-/AOh14GhZTZk2Ls8imbGSJYTXT6H-DwRSuA4uJq3HYPBz,Kenapa aplikasi dari kemarin eror ga bisa kebuka ya?,3,0,3.24.0,2022-01-02 07:34:52,,
gp:AOqpTOGHjxI_iZM38egx40MMFKV3tcxJRKXnYLjMRhNoGLgbE-XUmjW6nTct6eNY-iP4m2gp2Ul4klMa3wcsuA,Junaedi,https://play-lh.googleusercontent.com/a-/AOh14GhNAliFnl80SljBzdquKuiHMy_4bynbtGs39v2g,"Tambahin juga dong ahli warisnya di data diri, inikan investasi butuh waktu tahunan buat nyimpen uangnya, kalo gak ada keterangan ahli waris agak kwatir jadinya",1,8,3.22.3,2021-12-15 17:21:29,"Hai kak, di Bibit ada fitur ahli waris yang bisa kakak setting ya. Ahli waris kakak akan dikirim notifikasi lewat email dan SMS jika kakak tidak aktif di Bibit dalam jangka waktu tertentu. Info lebih lanjut hubungi layanan live chat atau WA +622150864230, tim support kami pasti segera membantu masalah kakak. Terima kasih


",2021-12-15 18:23:54
gp:AOqpTOEN74NZhGwVmEXypunZGblPdpCO2o5vcUtYL1T6uIVck-5Iyx65gf0RSsbg1ufM7LgTdiG-OQ92a0YvYg,Bambang Sugiharto,https://play-lh.googleusercontent.com/a/AATXAJxLf8caUEkH6PE2GWs8zywy7sTt1c_D6577XK-9=mo,PROGRAM KELOMPOK MASYARAKAT PETANI INDONESIA ( KMPI),5,0,3.24.0,2022-01-05 09:01:47,,
gp:AOqpTOGu5eVTh_mwkhZaK6uc644vQEEDOka7yEIIJVUXu_QEgKvsznhrItS6N1C9AzCWj7ITwdE94CfOibVgPg,Azalea Red,https://play-lh.googleusercontent.com/a-/AOh14Gi-WHMbcEgSF6gDnXe0i5W3141cVpP6vubwEezL,"Tidak bisa registrasi... Katanya data saya diktp ada yg berbeda dengan dukcapil, sudah bolak balik sy konfirmasi ke dukcapil kata dukcapil sudah sesuai, berkali2 juga kata bibit belum sesuai. Entah siapa yg benar",1,4,3.18.1,2021-11-16 18:57:17,"Hai kak, kakak bisa coba konfirmasi & validasi data KTP ke dukcapil setempat, selain itu minta agar datanya di update ke dukcapil nasional ya. Info lebih lanjut hubungi live chat Bibit atau WA +622150864230, tim support kami pasti langsung membantu masalah kakak. Terima kasih",2021-11-16 20:03:31
gp:AOqpTOGuQIQe6BdwhKBxO71q2rvTF-lT9BIoXjSXXUvSKCxOTfNko8wRdCtq8gKa-6pWR30ICSwJOLA0nUhC8A,Awwalin Mubarok Official,https://play-lh.googleusercontent.com/a-/AOh14GhZpi1lUCf6bFpqI_tnN8QZVl59CtecqzVb1c7D,Bibit menyadarkan ku akan penting nya investasi. Maacih,5,0,3.24.0,2021-12-29 16:18:26,,
gp:AOqpTOEjQ6qywlL2jFO48SLMSANhs2eKuGJb9u2CjojXUikVyNaOEv7E2W08zwNY546I8MC_mtCPRtDDaRXD6w,Edi Suyono,https://play-lh.googleusercontent.com/a-/AOh14GhUFFYNdFm81xAyHEoM3IE427lNpR5DgCqALOuCnQ,Mantap buat pemula yg mau ber investasi. Jangan lupa yg baru daftar masukkan kode referal saya. ( bjsaoap ),5,4,3.22.3,2021-12-19 09:45:33,,
gp:AOqpTOFqf0CehEffS3gB_LEBOmJ80W1_Ng1UsSxXMcIYSRW63QbZZGJlcfxubJhlgp6QOsUy9JDOLiYqhWhWWA,Bagas Dzuljalali,https://play-lh.googleusercontent.com/a/AATXAJyHHR__EBLYDf6yNvdmW7u9TnIXmxu8HJGM0rI68g=mo,Saya ada uang d tabugan bibit tdk banyak tapi aplikasi bibit saya skrng tidak bisa terbuka padahal jarigan saya stabil trimakasih bibit,1,0,3.25.0,2022-01-02 08:23:45,"Hai kak, mohon maaf atas kendalanya karena saat ini sedang ada gangguan dari providernya ketika membuka app Bibit yang terjadi di beberapa user. Untuk kendala tersebut sedang dalam proses pengecekan team terkait. Kakak tidak perlu khawatir karena data kakak tersimpan aman KSEI dan dana investasi kakak aman tersimpan di Bank Kustodian :) Trims",2022-01-03 09:55:44
gp:AOqpTOGLdE6--WPQz4NUcd2M8RUOnICYKhC3Xu2ycUcu6IL18E4D0Ox-cTP8BMsFv5MHsZ0jKJEiAfqEnyZkgw,Jembut Jembut,https://play-lh.googleusercontent.com/a/AATXAJz3HPUvy0nNBB2m3-79Uw-V2ueiumAK3fg-ATMM=mo,"aplikasi yg sangat buruk ..tidak sesuai s&k yg terttulis di apk..pencairan dalam 7 hari kerja tapi sudah hampir 1 bulan belum masuk juga, emang aplikasi sialan, bukan untung malah rugi",1,26,3.21.0,2021-12-15 08:21:20,"Hai kak, jika dana penjualan kakak belum diterima dan sudah melebihi batas waktu 7 hari kerja dari tanggal status ""order jual berhasil"", harap langsung hubungi layanan live chat Bibit atau WA +622150864230 agar tim support kami segera membantu untuk konfirmasi ke Bank Kustodian. Terima kasih
",2021-12-15 11:45:37
gp:AOqpTOG4yJm1OksrHRZV4NUEi5muooQ5RW2mD7g-jUhSufhIeZSJu9f8I02Fe0sGMhiPJ9CpvpNMWNBCANLSoQ,Jibran PB,https://play-lh.googleusercontent.com/a-/AOh14Gg3JZrPvxkIR2jPebIhi6Iq4oi8LkmoCvyVJDisGw,"Alhamdulillah udah berjalan seminggu lebih di Reksadana bibit ini, sampai sekarang untuk kinerja dari aplikasinya Alhamdulillah real banget... Terima kasih aplikasi Bibit karena udah Jujur dalam pengembangannya... Insyaallah aplikasi ini bisa menjadi tabungan masa depan semua orang...ðŸ‘ðŸ˜ŠðŸ™â¤ï¸ðŸ‘ŒðŸ»",5,92,3.18.1,2021-10-24 21:23:04,,
gp:AOqpTOHvm8his1l6N-PsVlhfNz033NoVfDfGBpWW-6kXuwbu9Eoro51J0_EqgTAxbut5jDjJqEn6UfUHE3wkiA,afifah alfinah,https://play-lh.googleusercontent.com/a/AATXAJwBbQS-KByS0Sg3y2x_6qJ77LOYeM0uR-A9d3kF=mo,"Cukup membantu dan fiturnya mudah dipahami untuk pemula seperti saya, gunakan code referal untuk dapat casback (t6kzvio) Semoga saat upgrade versi apknya tidak lebih buruk dari versi sekarang :)",5,12,3.19.3,2021-11-24 08:38:19,,
gp:AOqpTOG4cM1xDALWUvllxQmSKC8VGzkNdcc4vejNltUgxmFT6bU4MJNIZtbkbfEiPugiwqvckIFITAkQK73XLg,fadiel adiel,https://play-lh.googleusercontent.com/a-/AOh14GhiaWVl_kQA8pf4sQhgBiPVKboj-KhM9py8saolvA,Hallo kenapa apk bibit gk bisa di buka ???,3,0,3.24.0,2022-01-01 22:16:38,,
gp:AOqpTOEw9WrI69k3yBG6Zm1Y3Sbv7ABk_1Q1Hc2Uh0ECZrqQKwHVBmv94RfFMVWTbedNk6m8hi0XKksPEZd0tQ,Muhammad Sagena,https://play-lh.googleusercontent.com/a/AATXAJzyEOrAma9aL-OlQxlu7Bsnd4q6y2Af6-MUAJf8=mo,"Kok error trus,.aku buka aplikasinya kok malah error sih, aman gk sih",5,0,3.25.0,2022-01-02 22:02:41,,
gp:AOqpTOF4pqMevkyNWhLdgv7yl0oQYV-yVp3wTrvL02ytq0g1tMOBcAuRoOxqWZM-okELUzFrHVwzyp_A5n2O6g,Ayu Permatasari,https://play-lh.googleusercontent.com/a-/AOh14GgFKWXTacSV8qWKaE1NLm7nmAEkPDYRQnzA3Rmt,Udah selesai register malah ga bisa kebuka aplikasi nya,1,0,3.24.0,2022-01-03 06:02:10,"Hai kak, mohon maaf atas kendalanya karena saat ini sedang ada gangguan dari providernya ketika membuka app Bibit yang terjadi di beberapa user. Untuk kendala tersebut sedang dalam proses pengecekan team terkait. Kakak tidak perlu khawatir karena data kakak tersimpan aman KSEI dan dana investasi kakak aman tersimpan di Bank Kustodian :) Trims",2022-01-03 10:34:13
gp:AOqpTOG5cetjFWdtmd4PQRLaMGvXZ8YhQUD3GMZMu2AOTONaWPkGXbUnR2UAwBcHTqb0tVxWEQDbjcqETAoIFg,ash Beta,https://play-lh.googleusercontent.com/a/AATXAJw-aEx86QXuN6kycHwxamXNWIIkkFb5p_iQydDJ=mo,Bibit aplikasi pembohong.gue udah undang teman dan si teman sudah berhasil membuka bank jago katanya dapet cashback 15rb nyatanya sampe detik inipun tidak masuk tuh bibitXjago pembohong. Gue masih menunggu 7x24jam,1,9,3.22.3,2021-12-16 21:46:45,"Hai kak, pastikan kakak sudah mengikuti Syarat dan Ketentuan pada promo tersebut. Info lebih lanjut hubungi Bibit melalui layanan live chat/WA +622150864230, atau langsung hubungi Call Center Jago melalui email tanya@jago.com atau telepon 1500746/+6221 3000 0746. Trims
",2021-12-16 22:33:19
gp:AOqpTOFWr6Sx3P1Pjs8-jgHazklO3dBNGWyeTH8iUNQ9Xo4vzhkst8f8CQ-7Hbk7J4YteW8NQrWdCVHnQfAPUw,Bongol Bedegul,https://play-lh.googleusercontent.com/a/AATXAJxJOXxcA0PowCmICdIhd2d_5AtHOdqYqVEE-UhC=mo,Mantap aplikasi bibit ini fitur fitur nya mudah di mengerti bagi yang pemula dan investasi pun bisa di harga rendah .. Jadi bagi para pemula ayo segera download aplikasi bibit dan terus investasi kan uang jajan kalian ya itung itung nabung tapi bertambah dengan sendirinya ..,5,39,3.21.0,2021-11-26 17:32:51,,
gp:AOqpTOGAbuLRsJTX_sqoHMrNnICnaaZSpp-HoX2Co21IcCaS4cAgrG5FZg8NQCcHsWXXrC6Ssgo7GwYyPEa0UA,bae haki,https://play-lh.googleusercontent.com/a-/AOh14GiIXrTC-kC-zTdfINIc6ClltO_n3qKH2U_QbI31Ww,Payah pencarain dana lama bgt . Tidak rekomendasi. Payahh,1,0,3.24.0,2021-12-27 12:46:36,"Hai kak, seluruh transaksi di Pasar Modal harus mengikuti regulasi dari OJK ya, termasuk Bibit. Batas waktu pencairan dana Reksadana ke rekening nasabah yg dikirim oleh Bank Kustodian maks 3 hari kerja utk RD Pasar Uang dan maks 7 hari kerja utk RD Saham & Obligasi. Info lebih lanjut silahkan hubungi live chat Bibit/WA +622150864230. Terima kasih",2021-12-27 14:01:17
gp:AOqpTOHBRCyBfmH4zCcZdxDK7meYGgMlg1pC2mTG9EWb-z8L8i10H3n57BRYqWooZBvwsFuhrpXVfKudP2sY0Q,D.O.T Tipi,https://play-lh.googleusercontent.com/a-/AOh14GgyUbI-RPJbyp40ecugUuK4Rd-gD3IxtVhm4gOLQQ,Pakai kode referal DOTTT dapatkan cashbak 25.000. Salam investasi,4,0,3.24.0,2021-12-24 10:43:50,,
gp:AOqpTOG8oaeHlygbEFt00HPVZCi2RD20BuHVDV3-W_aq6H-G1atGv1vh1BZvM4pTeoFbY5TDqUJ0kVODSxriQw,Nunik Pawitri,https://play-lh.googleusercontent.com/a-/AOh14GgIfKjyfbUtgsulPq8DIJjBP5oq73vppw_GiBBTQQ,Yuk download bibit serta gunakan kode untuk dapat cashback (jajananberkah) dan investasi skrng dengan aman karena bibit diawasi OJK. Reksadana nya macam-macam. Mantap pokoknya investasi dibibit,5,2,3.18.1,2021-11-24 20:19:54,,
gp:AOqpTOGJiY3YN3nUcXWIGG6yX-Mu8UMsI3P0wKJjVp4-saxzfaRjKL2F8_H1um67aJthvMJKXol8P8G0Mb4FiA,Budi Setiawan,https://play-lh.googleusercontent.com/a/AATXAJwGNWEYWc-sdZP32-xOEsWDlQXS9RLw6_dSFblq=mo,Aplikasi bibit saya kenapa ngga bisa di buka ya??,3,1,3.25.0,2022-01-02 19:35:06,,
gp:AOqpTOGv9ci_ynlg9zFK0cwgyBWN6NB1N7AycsumySUJMJOcqRtYsG3YkiUxlEpDpmJc47BuWB__NF9177x1Vg,Muhammad Afriansyah,https://play-lh.googleusercontent.com/a/AATXAJxg38chXqsxu_aVSeUiALYlX6fS21YwL2JsmbVl=mo,"App nya keren bngt,kita bisa atur keuangan disini,yg baru mulai investasi disini yuk gunain kode [ancacawang] biar kamu bisa dapetin cashback sebesar 25.000 dan lebih besar lagi",5,7,3.19.3,2021-11-18 00:47:00,,
gp:AOqpTOE9-tCQ1sHddmtkzmIdWfaoirBGkBu4WoUFl8ZDmX7zEmZz_lv46Q_rfhgKms1vXneOyiwnzHkW7P6TOg,Alebrother 017,https://play-lh.googleusercontent.com/a-/AOh14GgsYtyIlCUBMul2SCj2yK80glBZyFbG-9cdAqKoig,Gk bisa di buka Halaman eror katanya Apa solusinya min ?,3,0,3.24.0,2022-01-02 07:17:39,,
gp:AOqpTOFIianQCLM6wf9yQ2d3JW87IE_m_QezZ9zutEN2AndPDWkzycllGfaEV0ovt5NGNpEq_RBWHtPj96ScIg,Bly Channel,https://play-lh.googleusercontent.com/a-/AOh14GiGnxO2pwRhk_VBkJk8nnQ6hGtmRUUkuYhbk2iNWA,"Apakah applikasi bibit ini menggunakan system di telegram.?dan kenapa keuntungan profit yg di telegram lebih besar,dan kontak yg sangat oendek yakni kisaran 3 jam.thanks",5,5,3.19.3,2021-11-22 19:30:24,,
gp:AOqpTOHST7NwpMDJ8VWmaWZ6X6-cpFuVrbXt05I7yeZyywvPpPeVUWrX5yYj85zfgEEPNJWYyKQJHv2_IDiEbw,SM Simunir,https://play-lh.googleusercontent.com/a-/AOh14GgI1naS86hyixZuNq7X66M8z8gIIInG82AWAUbk,Cari uang kok sampek kyak gini!!! Pakek poto selfi segala... Emangnya apaa hubungannya! Kan kita sudah bayar + ada rekening ... harusnya itu cukup soalnya kita nggak NGUTANG OE,1,6,3.22.3,2021-12-18 10:57:09,"Hai kak, registrasi di Bibit harus menggunakan KTP, selfie kTP & Rekening Bank atas nama kakak yg terdaftar pada bank di Indonesia. KTP diperlukan sesuai dengan POJK Nomor 23 /POJK.01/2019 Tentang Penerapan Program Anti Pencucian Uang dan Pencegahan Pendanaan Terorisme di Sektor Jasa Keuangan. More info: live chat Bibit/WA +622150864230. Trims",2021-12-18 17:59:02
gp:AOqpTOFl3lxFyqpK6Yx_-ie3A164JOGtYoIyQAJU4-dpRsrstbo42N82g3EeJM7xUwXWRA6aT7MG1swkYuSdOA,Lanina Simamora,https://play-lh.googleusercontent.com/a-/AOh14GiqztYg9L85GprBV6yYbZYcAcs9kmIm2XcerCZuiw,"Kapok make ini aplikasi, gabung di telegram di tipu sama admin nya sendiri. Mengecewakan sekali, padahal termasuk aplikasi besar. Yg mau download mikirÂ² lagi mending.",1,20,3.19.3,2021-11-09 16:02:18,"Hati-hati penipuan mengatasnamakan Bibit. Akun resmi Bibit sbg berikut; Grup Telegram yg hanya bisa diakses melalui aplikasi, WA Bibit +622150864230 & +622150864221, Website: Bibit.id, Instagram: @bibit.id, Twitter: @bibitid, dan Facebook: Bibit. Kami menghimbau agar tidak memberikan OTP, PIN & nomor rekening kpd pihak yg tak dikenal. Terima kasih",2021-11-09 16:54:20
gp:AOqpTOEkQmRtVDVibd0rPbQ0SGoTwXhTUPUMhgbwdLHZH8yeqocM3GDP6B4WtAlBsmFHS0N8HflaqSkVmpcOkA,horas sitindaon,https://play-lh.googleusercontent.com/a-/AOh14GhI21VSNot3aw1kNgjZQiuAObG4kJe6E-9lRJaw,"Mantap nih..bank jago dan bibit mempermudah menabung, investasi,top up e wallet, transfer online antar bank..top bgt..segera buka dan menabung memakai referal : sitdn TERIMAKASIH",5,12,3.21.0,2021-12-06 18:00:07,,
gp:AOqpTOGwQ1Y7whkDRizUnfxnuivAioxIyyjFf3DIqS04dZcJZnJAQRV5Rt4XYTolBqqzpT3VDK35TlUCkqwPiQ,asep rahmat,https://play-lh.googleusercontent.com/a-/AOh14Gj0ji5_IefUjLI8IQ6aB5_MU0njBrH2hKBXMBhc-Q,Sampai saat ini Hati Sy msh Senang sama Bibit... karena itu Sy kasih Bintang 5. Sekedar mengingatkan Saja Untuk Bibit Teruslah Berinovasi dan Memberi Kemudahan Dalam arti Luas karena Sy Yaqin kedepannya makin banyak kawula muda yg mau Berinvestasi. Trimakasih Bibit... Sukses Slalu untuk Bibit.,5,143,3.21.0,2021-12-05 16:07:56,,
gp:AOqpTOF_T0skP-HIYEIOoMVWSlRRf35pAz9DueyCkXOCfIg577GNjz5mxug2qBBqNnkEVvIQ6lh9QFn20M4cwg,Taehyung Arsy,https://play-lh.googleusercontent.com/a/AATXAJyopyhlFagF-uOWXg8StzcAmT8DbkvGYT-b2eod=mo,Lama sekali mencairkan. Saat butuh dana .. Ini aplikasi gimana sih?? Mau nabung ajah ribet banger.. Sampai skrg uang saya belum cair2.. 500rb itu lumayan lho buat saya yg pas2n,1,12,3.19.3,2021-11-15 13:19:23,"Hai kak, dana penjualan mengikuti NAV yg kakak dapat dan dikirim Bank Kustodian ke rekening terdaftar di Bibit sesuai ketentuan OJK maks 3 hari kerja utk RD Pasar Uang dan maks 7 hari kerja utk RD Saham & Obligasi. Jika lebih dari itu dana belum masuk, hubungi live chat Bibit/WA +622150864230 agar tim support kami bisa bantu lebih lanjut. Trims",2021-11-15 15:55:07
gp:AOqpTOELtzCv88mWoZUYzQTKv1tHv4hykWnA-AQKgOUbP6LlJJKMF_ZoeMlWnrt3g2tThLeNpkbMKed729H-Hg,Theodora Pangaribuan,https://play-lh.googleusercontent.com/a/AATXAJy3pSniNWlYLZZm_9bxEN_V4e6v6tBXxzgU7vu1=mo,Aplikasi saya kenapa tiba2 error.Nggak bisa dibuka.,3,0,3.24.0,2022-01-02 18:41:18,,
gp:AOqpTOHtyprDGZpjJ13nhX62JRyOVXvzbpUWz6qof-nUZ5zQvQzmF7oikx_3TAjrV0JKud_hPtamBHm8ZYZxNQ,Ahmad Romadoni,https://play-lh.googleusercontent.com/a-/AOh14GjHUL_7RM9bVKzZrXWolZGQP_-dDVmrx31Zn2aY,"Untuk saat ini aplikasi ini, dalam pengelolannya bagus,cuma respon saat kita beli reksadana masih cukup lambat, kalau untuk yg lain ok lah, boleh di bilang seru juga, saya ambil investor agresif, sekali down cukup gede, tapi pas lagi up untung nya gede juga,ya mudah""an kedepannya lebih lancar dan lebih cepat saat proses pembelian reksadananya.",4,91,3.18.1,2021-10-21 17:42:56,"Hai kak, terkait transaksi tersebut kamu melakukan transfer yang nominalnya tidak sesuai dengan nominal pada order pembelian dan akan di refund. Silahkan hubungi layanan live chat di aplikasi Bibit/via WA +622150864230 untuk kami bantu prosesnya ya. Terimakasih
",2021-04-01 11:13:11
